raw_character_text,spoken_words
Moe Szyslak,"All right, enough chit chat. Let's see how ya like flaming garbage!"
Moe Szyslak,"Hey, hey, no menus! Or I'll cut ya like a box -- along the flaps!"
Moe Szyslak,"Homer, ah, booze is on the house, seeing as how Lisa is, ah,... how do I put this... uh, ridin' the midnight train to slab city."
Moe Szyslak,"Well, I ain't never said no to a dead girl yet."
Moe Szyslak,"Well, if Mr. X were here right now, I'd buy him a tall frosty."
Moe Szyslak,"I dunno if I want you in here no more, Homer, uh... I got a lotta secrets I'd prefer to keep clandestine. Terrible, disturbing secrets."
Moe Szyslak,And I was a lot happier before I knew Dame Edna was a man. A lot happier.
Moe Szyslak,"So whaddaya want here? Uh, Appendectomy, lipo, or the ""sampler""? That's very popular."
Moe Szyslak,"All right, tell me when I hit the sweet spot."
Moe Szyslak,"Hey, it don't hurt no more. Heh. Now I can focus on my crippling emotional pain. Oh, Daddy, Daddy, why? Why won't you hug me? You hug the mailman."
Moe Szyslak,"Get out and take your Sacajawea dollars with you. I'll give ya till ""three."""
Moe Szyslak,"Ah, these, aah, they're just painted on, there. Your choices are beer and, ah... egg soakin's."
Moe Szyslak,"Oooh, boy. All right, let's see here, uh... Well I was born in Indiana... so that ain't it. And, uh... I better call my Lifeline."
Moe Szyslak,"Homer, please. Ha ha. I got a nuclear-type question, here."
Moe Szyslak,"Well... Gee, I really do love currency... but, um, I think I'm gonna play it safe and stick with what I got."
Moe Szyslak,I got a better idea. Let's have a fun run...on his trachea.
Moe Szyslak,"They bought 'em a year ago, from the Mafia. It was the last of the family-owned teams."
Moe Szyslak,"Hey, hey, watch what you're doin' there, sack monkey. You're bruisin' my DuraLog."
Moe Szyslak,No problem. Just stick the ol' eye-gouger in the pickle brine. That'll keep your thumb fresh and delicious.
Moe Szyslak,"Oh, hey, get outta the way, pal. You're blocking the exit."
Moe Szyslak,I think it's a sign from God that we should all go nuts.
Moe Szyslak,"Yeah, but they come over here in the wheel wells of Aer Lingus jets."
Moe Szyslak,"Oh, the heat's been on since them Bush girls were in here."
Moe Szyslak,"Wait a minute, Homer. If it's true, what about all the stuff you weren't around for?"
Moe Szyslak,"That is the stupidest story I ever heard, and I've read the entire Sweet Valley High series. Ha. I am sick of you drunks and your shaggy dog stories."
Moe Szyslak,"Ah, quitcher bellyaching, coffee boy. You're lucky I let ya in here."
Moe Szyslak,"But, can you blame me? Every day it's the same old routine. I serve you drinks, you yak on and on and on, and I never get one stinkin' tip."
Moe Szyslak,"Ah, who am I kiddin'? I ain't smiled for real since I nailed that rat with the ice pick. Ha, remember that?"
Moe Szyslak,"Ahh! How did I lose my passion for the job? When I was in bartending school, I thought I had the world by the jigger."
Moe Szyslak,"Ah, I put this up recently, and it's a good thing I did, 'cause it really illustrates my point. Yep, good ol' Swigmore U."
Moe Szyslak,What's the word I'm searching for? Uh... yeah! A trip to the alma mater might really rekindle my love of gettin' people loaded.
Moe Szyslak,"Look, I don't wanna start A tinklin' contest here... or do I?"
Moe Szyslak,"... And if anybody wants potato chips or anything fancy, tell 'em to go to hell."
Moe Szyslak,"Hey, what are you doin'? I gotta pay for that!"
Moe Szyslak,"Professor, I'm um, I'm burned out on bartending. I, when I first saw the movie Ironweed, I thought, ya know ""this is for me."" But now, well, I'm not so sure."
Moe Szyslak,"Hey, don't you wanna take your shoes off before you go swimming? Professor? Oh. Oh. Um. Mm."
Moe Szyslak,"My Professor said if I prettied up this dump, it would renew my zeal."
Moe Szyslak,"And now, I want you to meet the guy who's gonna help bring Moe's into the twentieth century."
Moe Szyslak,"Welcome to ""m""! Huh? So, what do you think of the new joint?"
Moe Szyslak,"It's Po-Mo! Post-modern. Yeah all right, weird for the sake of weird."
Moe Szyslak,We don't serve Duff no more. We got a Malaysian beer that's better than Duff... It's made outta soy sauce.
Moe Szyslak,"Eh, you'd be having a great time if you'd stayed in your dark spot."
Moe Szyslak,"Is it? Oh, well that's it. That's-- Dagmar, Julian, throw this bum out."
Moe Szyslak,"Yeah, no, no cord at all... on those. Hey, game's on!"
Moe Szyslak,I'm glad you ain't around to see what a mess I made.
Moe Szyslak,"How could I toss my friends out into the cold, with no place to get liquored up?"
Moe Szyslak,But it's illegal! You can't run a bar in a private residence.
Moe Szyslak,"Ah, here we go. It also says, ""a licensed hunting club must actively engage in the sport of hunting."""
Moe Szyslak,"Listen, I don't like you and you don't like me. But we both want to stop Homer from shootin' a turkey."
Moe Szyslak,"You do? Then I like you, too. Here, have a towelette."
Moe Szyslak,"All right, from now on, no talkin'. If you want to signal me, use this bird call:"
Moe Szyslak,"Oh, that actually feels good after the... after the crotch."
Moe Szyslak,Not if I scare it away with this cougar call.
Moe Szyslak,"Ah, that's okay. It's like my Dad always said, ""Eventually everybody gets shot."""
Moe Szyslak,And that's how a troubled young Moe saved the day.
Moe Szyslak,"What am I-- My bar is empty, is what. Why ain't you guys there?"
Moe Szyslak,"What? You mean that time he wigged out? Well, uh, gimme some of that Indian memory tea, there and I'll tell you all about it."
Moe Szyslak,"Mmm, that's good Yaqui... Okay, that night we camped out under the stars..."
Moe Szyslak,"Ow! / Ow, that hurts! / Man we're stupid. / I hate you guys."
Moe Szyslak,"The next morning, we went out to the old quarry to have a swim..."
Moe Szyslak,"And there's your whatchamacall repressed trauma. I mean, who likes getting muddy? It's terrible. Okay, let's go to Moe's now."
Moe Szyslak,"What I wanna know is, what the heck was that body doin' there?"
Moe Szyslak,"No, no, no. He said Simpson family. I mean, you know, it sounded exciting, but, uh... you know, we, we don't wanna intrude..."
Moe Szyslak,"Hey, hey, I found a clue that's gonna bust your mystery wide open!"
Moe Szyslak,"Oh. Well, you wanna take a look at it anyways, uh just for ha-has?"
Moe Szyslak,"Yeah I guess you're right. It's just that I, you know, went to a lot of trouble, you know makin' the envelope and everything..."
Moe Szyslak,"Okay, now this first thing is just gonna look like a used Band Aid. And it is. But the rest of this stuff won't make no sense without it. So uh, bear with me."
Moe Szyslak,"Oh yeah, oh yeah, I sleuthed my ass off on this one."
Moe Szyslak,"Okay, this is a number six from somebody's address. Or is it a nine? You don't know. Uh, this is gravel. Okay? Gravel. This is uh, that's more gravel. Okay, oh. This is a shell, that to me -- this is just me talkin', it looks like a helmet for a mouse... Now, that sounds crazy, right. But if you ask a mice about it, they don't say nothin'. I mean they run the other way. At first I was just fishin' with the helmet thing. But then from the mouse's reaction I got, I got a little more concerned."
Moe Szyslak,Oh I really felt there was a connection and I-I would definitely go out with her again.
Moe Szyslak,"Hey, he bit me back! So that's how it's gonna be, huh?"
Moe Szyslak,"Ah, you must be here for the uh, Duff trivia challenge."
Moe Szyslak,"Oh, oh, what are you doing? You're gettin' some kind of booze all over."
Moe Szyslak,"Hello? Yeah, I'd like to arrange for an escort please."
Moe Szyslak,"Yeah, I can't get Artie out of my head. He's like a spy in the house of Moe."
Moe Szyslak,"Ah, well if it makes you feel any better, he's probably doin' her right now."
Moe Szyslak,Is it true that if I kill you I become you?
Moe Szyslak,So how much you lookalikes make? 'Cause some say I look like Macaulay Culkin.
Moe Szyslak,"Aw, look at 'em, sleeping like little angels. Spare no one."
Moe Szyslak,"Remember, just 'cause their heads are off, it don't mean they're dead."
Moe Szyslak,"Yeah, I really miss the old guy. It was all I could do to put on his jewels."
Moe Szyslak,"And score with his wife every night. Hey, how ya doin', kid? Nice to see ya."
Moe Szyslak,"Okay, well I'll do a soliloquy too. Note to self: ""Kill that kid."""
Moe Szyslak,"I mean I didn't use that much poi, son. At the royal luau."
Moe Szyslak,"Ha. Ha. Cute kid. But, just in case you don't kill Hamlet, I put some poison on the food, on the drapes, even on Rosen-Carl and Guilden-Lenny here."
Moe Szyslak,"Ah, now Hamlet, you know the rules. Laertes here gets uh one practice stab."
Moe Szyslak,"You sure you don't want a nice piece of fish, or to finger the drapes a little?"
Moe Szyslak,"I gotta admit, I-I'm kinda nervous, here. We haven't seen Barney since they enveloped him."
Moe Szyslak,"All right, that's it. Get 'em outta here. This ain't no crow bar."
Moe Szyslak,"You mutton heads, this is why we can never hold down a job!"
Moe Szyslak,"What's the matter, Homer? You're drunk but you're not like sloppy drunk."
Moe Szyslak,"Look, I, I'm really glad you're off the wacky tobacky."
Moe Szyslak,I was already makin' excuses not to go to your funeral.
Moe Szyslak,"Yeah, a meditative lily-pond, with big beautiful fish that fry up really good."
Moe Szyslak,"Well, we've all got that voice in our heads telling us to kill. You just have to drown it out."
Moe Szyslak,"I'VE BEEN WORKING ON THE RAILROAD / ALL THE LIVE LONG DAY... Yeah, that's better."
Moe Szyslak,Oh no! The power's out! We'll miss Fox Celebrity Boxing!
Moe Szyslak,Wait a minute. I'm at work. Ya gotta pay for it.
Moe Szyslak,"Yeah, I guess I got caught up in all the glitz and glamour."
Moe Szyslak,"Hey, we can't let our friend drive like this. I'm liable, here."
Moe Szyslak,"Wow Homer, I ain't had front row seats since my Moonie wedding."
Moe Szyslak,"Oh yeah, it's good to see the spectacle back in rock."
Moe Szyslak,YOU'RE SEXY AND EXOTIC / LIKE A HOOKER FROM BELIZE.
Moe Szyslak,"Uh, I wouldn't eat them peanuts. They're uh, they're spit-backs."
Moe Szyslak,"Otto, what're ya waiting for? Get your ass on my neck."
Moe Szyslak,"Oh, great. And I just got all that gum outta my armpits."
Moe Szyslak,"Come on, guys, you gotta stay. Tonight's the big cock fight. Ah-- We can eat the loser..."
Moe Szyslak,"Telegram for Heywood U. Cuddlemee. Heywood U. Cuddlemee? Big guy in the back, Heywood U. Cuddlemee? He-- Ooh, that little... Ooh! I'm gonna drive a golden spike where your union meets your central pacific. Stop."
Moe Szyslak,"My poor jar. Oh, why didn't I take more photos?"
Moe Szyslak,"Yeah, at least you ain't aging six years for every one 'cause of your cow heart."
Moe Szyslak,"Ah, well, whenever I gotta know something about a broad, I use this guy."
Moe Szyslak,This detective is unbelievable. He can learn more about a chick by digging through one garbage can than you could from years of intimacy.
Moe Szyslak,"Uh, yeah. Miss September, I think you're gonna have to get in the trunk."
Moe Szyslak,"Uh, listen Marge, how can I put this delicately? I don't got enough booze in this place to make you look good."
Moe Szyslak,"Hey, hey, you can't throw us out. I just made a Cornish game hen with chestnut stuffing. Would you believe a pigeon stuffed with Spam? Would you believe a rat filled with cough drops?"
Moe Szyslak,"Full house, jacks over twos. Ha ha-ha, read 'em and strip, Barn."
Moe Szyslak,"Yeah, I say we skin him alive and set him on fire."
Moe Szyslak,"You tell her, Big H! / You da man! / Eh, you ain't so hot."
Moe Szyslak,"Aww c'mon, hey, spell ""Little Miss she thinks she's so big."""
Moe Szyslak,I ain't got time for this. I got a bar to run.
Moe Szyslak,"Can't your old buddy Moe stop by with a list of questions from the Weekly World News? Number one: Sara, is it true you shoplifted a kayak?"
Moe Szyslak,"Another scoop. Sara Sloane to attend girl-on-girl book club. Moe, you loveable loser, you just made yourself five dollars!"
Moe Szyslak,The government wants to shut me down 'cause the pipes under my toilet don't lead nowhere.
Moe Szyslak,"Well, if this guy's ridin' your rump, why don't you slap him some payback?"
Moe Szyslak,Or give him some face time with sweet lady brick.
Moe Szyslak,"Okay you filthy booze-bags, it's two a.m. So uh, who's the designated driver?"
Moe Szyslak,"No one's ever won Moe's ""Drink A Gallon Of Gin Challenge."" And no one ever will."
Moe Szyslak,"Uh, he was drinkin' at Harrigan's Bar down the street, there. They oughtta close that dump down."
Moe Szyslak,MOE MOE MOE / HOW DO YOU LIKE ME? / HOW DO YOU LIKE ME? / MOE MOE MOE / WHY DON'T YOU LIKE ME? / NOBODY LIKES ME...
Moe Szyslak,"You heard 'im, fleabag. Get outta my bar, you're unsanitary."
Moe Szyslak,"No, no, don't get up, sweetheart. I'll just, I'll just pick around you. There we go."
Moe Szyslak,"I don't think he's here... hang on, let me check."
Moe Szyslak,Huh. Hey maybe this is a sign. Maybe it's time for me to get out of the alcohol business. Give barber college another try -- and this time I won't join a frat.
Moe Szyslak,"You wanna know how to make a peach crumble? Kick it in the groin. Ha, anyway, what's goin' on?"
Moe Szyslak,That's odd. It's eleven fifteen in the morning and the bar is empty.
Moe Szyslak,"Hey, those are my customers-slash-only friends! Where are they getting their beer?"
Moe Szyslak,"Eh, no point in mopin' around. I might as well join 'em and have a jolly old time."
Moe Szyslak,"Here I am, one of the crowd. I'm comfortable I'm calm. If anybody looks at me I got a hypodermic full of bleach."
Moe Szyslak,I'd prefer that you push me. Seein' how I'm desperate for any human contact.
Moe Szyslak,"Listen to those lucky people, enjoying that pretty flower. I got nothin' -- just this can."
Moe Szyslak,"Well, this is it. The last call for Moe. God. God, God..."
Moe Szyslak,"Hey, I was in the neighborhood and uh, thought I'd, y'know, check in on Maggie."
Moe Szyslak,"Aw, look at that. That's so soft and thoughtful and what's the gag? Is it full of chiggers?"
Moe Szyslak,"Aw jeez, there's somethin' in my eye. Ah, it's just glass."
Moe Szyslak,"Me? Yeah, uh... yeah, sure, i-i-if you don't think I'd spook her or nothin'."
Moe Szyslak,"Hey, you-you wanna see me uh, dislocate my arm? Take a look at this."
Moe Szyslak,It was years before I could do this without faintin'. Still hurts.
Moe Szyslak,"Hey, Mag. Raggedy Andy over there has been giving you the button-eye. I'll get rid of him. All right, come on. Out you go."
Moe Szyslak,"Oh, no problem. You know, it-it gave me kind of a good warm feelin'. Like when you get drunk and fall asleep in the snow."
Moe Szyslak,"I-I'd love to. Uh, uh let me check my schedule."
Moe Szyslak,"Well, I was gonna erase those two apostrophes and replace 'em with 'g's, but that's about it. So, you know, call anytime."
Moe Szyslak,"Why is she crying? Oh, that's right. I still got her nose."
Moe Szyslak,"Ball pit, that's nice. One, two, three colors -- you got 'em all."
Moe Szyslak,"Oh, great. Uh, well why don't you play with the baby while I go rent a room?"
Moe Szyslak,"Boy, that's one for the Christmas letter. What a nut."
Moe Szyslak,"Okay, we won't tell no one about that. Now let's see, what else can we do? We can't tickle Elmo no more."
Moe Szyslak,And this Slinky... these things are fun for about two seconds.
Moe Szyslak,"Hm. ""Alice in Wonderland,"" huh? This must be a take-off on that ""Alice in Underpants"" movie I saw."
Moe Szyslak,It's so nice to be with someone who can't understand the horrible things I say.
Moe Szyslak,"White rabbit... chicks poppin' mushrooms... this is like the Playboy Mansion. Maybe I can think of a story uh, more suitable for a baby."
Moe Szyslak,"Ooh, I got one: it starts out with a beautiful wedding."
Moe Szyslak,But the father of the bride was nowhere to be seen.
Moe Szyslak,He was granting favors to all of his bestest buddies.
Moe Szyslak,"And the Godfather's playing with his grandson, see. So he sticks an orange in his mouth, like this."
Moe Szyslak,"Don Bardzini gets whacked. Tessio, Ohh... you won't see him no more. Moe Greene: Bam! He gets it right in the eye. And Michael is now the new Godfather. And he shuts the door on Annie Hall."
Moe Szyslak,"Oh, no, no baby. No, no... Okay, Part Two. Little Anthony's having his first communion at Lake Tahoe. Meanwhile Michael can't get a gaming license. But Senator Geary's got one weakness: call girls..."
Moe Szyslak,"Oh, there she is, the birthday girl. Oh, your mommy tied a bow for you, huh. I'd better retie it -- the way you like it."
Moe Szyslak,"I know it don't seem like it matters, but you know, she hates lookin' like crap."
Moe Szyslak,"Hey, hey, hey, Osh Kosh B'Gosh. She don't want what you're shovelin'."
Moe Szyslak,"Yeah, great present, Selma. Nice of you to break a five."
Moe Szyslak,"It's Uncle Moe's Play Tavern, with classic drunk Barney. Look, even the little toilet is broken."
Moe Szyslak,"Well, Maggie was crying. I heard her on my baby monitor."
Moe Szyslak,I had to. It's so weird watching the video and not getting any sound.
Moe Szyslak,"Hey, you never cared about Maggie 'til I started paying attention to her. Last night at the bar you called her ""Raquel."""
Moe Szyslak,"Is that uh, ""get out"" like leave, or ""get out"" as in: ""Get out. You banged Bridget Fonda?"""
Moe Szyslak,"Maybe I can catch a late show of ""Alice In Underpants."" Or maybe ""Put 'em on the Looking Glass."""
Moe Szyslak,"Boy, I'm like a mess here. I feel so lonely without that kid."
Moe Szyslak,"Maggie's missing? You gotta let me help find her, please! We have a special bond. Even greater than her bond with the duck-shaped washcloth."
Moe Szyslak,"Listen, I think we might have to make a trip to Little Italy."
Moe Szyslak,No. You've got a family. I'm the guy with nothin' and no one.
Moe Szyslak,"Gee, uh, this is the second-most guns ever pointed at me."
Moe Szyslak,"You know, a couple weeks ago I wouldn't have minded if you shot me. But all that's changed, because of this little girl here. Look at her. Ain't she a doll?"
Moe Szyslak,"Hey, hey, hey, the important thing is, little Maggie is safe."
Moe Szyslak,"Well, I gotta get home. There might be a telemarketer calling or something. I'll see you when you're old enough to drink, okay, Magpie."
Moe Szyslak,"Oh great, I'm caught on another tree. Lousy shirt-grabbin', sap-drippin'..."
Moe Szyslak,"If I knew this would take so long, I'd'a put on the TV."
Moe Szyslak,"To repeat what I said a moment ago: ""You are so dead."""
Moe Szyslak,"Mrs. Simpson, when you took off, you left a hole in Homer's heart that he's been trying to fill with alcohol for twenty years... God bless ya."
Moe Szyslak,Uh... it would have to be somebody famous... I'm gonna say Hitler?
Moe Szyslak,"How much to have Bart crank-call me? That would be hilarious. Eh, that's just me, though. You know, I love to laugh."
Moe Szyslak,"Now, wait a minute. Dirty words you can spell on your calculator is a very important subject."
Moe Szyslak,"I will! And then you'll all wish you was nicer to me! Eh, who am I kiddin'? I ain't gonna jump."
Moe Szyslak,Feeling... flu-ish. Fever... nausea... Child germs! No! Must... participate in... democratic... pro... cess...
Moe Szyslak,"Go! Go! Geez, I'm the only one in the audience over fifteen."
Moe Szyslak,"Can you believe that Homer and Marge's marriage is just a sham? All right, I'll order. Um, I'll have a medium pepperoni. And can you space out the meat so it spells ""happy birthday Moe""? Oh, God I'm alone."
Moe Szyslak,"All right, customers! And they said you couldn't open a bar in Kansas."
Moe Szyslak,"Just get out this door, rummy, and you're the city's problem. If you make it through the night, you're welcome back."
Moe Szyslak,"Don't worry, sir. The maid and I will take him out to the curb. C'mon, c'mon."
Moe Szyslak,Wait a minute. How can you arrest Homer? This guy's the one what done the thing that why you're here for. I'm talkin' malfeasance here.
Moe Szyslak,"Well, well look who showed his face. The louse who sold out his only friend. You've got a lot of nerve comin' here... but since you did, what'll it be? First one's on the house."
Moe Szyslak,"You know, they say that the love of a good woman can save any man."
Moe Szyslak,"Well, if you change your mind, you know where I am."
Moe Szyslak,"All I got is this old stuff here. Chateau Latour -- eighteen eighty-six? Oh, I should just throw this out."
Moe Szyslak,"Now, in a step I perhaps should have taken initially, let me look up the value of that bottle in this wine collector's guide."
Moe Szyslak,"Oh, what have I done? Lemme dry my tears with this lost Shakespeare play."
Moe Szyslak,"What? It's 'cause of her I put in a bidet. Well, it's actually just a step ladder by the water fountain."
Moe Szyslak,"Hey, look. I've been in the bartender business for a long time alright, I've heard it all."
Moe Szyslak,"What are you? You're like a monster! That's like the worst thing I ever heard anybody do to anybody. You should be drinkin' watered-down beer in-in-in a chipped glass, on a stool with a nail sticking up."
Moe Szyslak,"All right, but I get to poke you with a stick."
Moe Szyslak,"Oh my God -- we're sealed in! Hey, nobody breathe my air -- get your own!"
Moe Szyslak,Let's kick this up a notch and get you some wiggle in your lap.
Moe Szyslak,"Geez, Homer, this guy is bringin' the whole bar down. I finally got Barney back on the sauce. If he doesn't have fun, he could easily slip right back into sobriety."
Moe Szyslak,"Yeah, and Homer's a dumbass! No offense, Homer. Ya dumbass."
Moe Szyslak,"That's right, you're workin' in the kitchen. That's how our camp pays the bills."
Moe Szyslak,Twelve kids died at our camp. We need the money to pay lawyers.
Moe Szyslak,"Don't worry, chicks love that kind of thing -- patches, scars, stumps... Everything but zits."
Moe Szyslak,"Hey, don't you try and prank me with a fake name -- I'll rip out your intestines and use 'em to make a lanyard... Hello? Hello?"
Moe Szyslak,"Okay, well, I really enjoyed being you, Dr. Hibbert. Uh, oh by the way, you're not welcome in the library no more. I'm sorry."
Moe Szyslak,"Homer... this bar's only for real Americans. And people on permanent visas, like me. What? What are you all lookin' at? I'm Dutch. Eh, forget all of you."
Moe Szyslak,Looks like me and Marge are both goin' to Hell. That's when I make my move.
Moe Szyslak,Do you have a T-shirt with Calvin peeing on Hobbes?
Moe Szyslak,"Yeah thanks. I bought this for my funeral. It ain't got no back, so don't make me turn around."
Moe Szyslak,"Hey, I'm payin' for a silk-lined coffin. And dammit, I'm gonna feel it!"
Moe Szyslak,"Guys, this is Frankie from the Health Department. We go way back. Lenny, you don't have to hide that rat."
Moe Szyslak,"When we were kids, our dads used to get drunk and make us fight each other."
Moe Szyslak,"That time you blinded me, he gave you a bike. That sure was a good soundin' bike..."
Moe Szyslak,"So, uh, Mr. New Guy. Whaddya think? Is everything... hunky dory there?"
Moe Szyslak,"Oh yeah. Uh well, ya see, uh trash day ain't 'til Wednesday..."
Moe Szyslak,"Oh man, I can't afford to fix all that stuff."
Moe Szyslak,"Aw, nuts. If anybody needs me, I'll be in the john."
Moe Szyslak,"It's too late -- I don't got the cash to clean up the bar. From now on, you guys are gonna hafta do your drinking across the street."
Moe Szyslak,Do whatever you have to do to save Moe's. I love my Homie.
Moe Szyslak,"Thanks, Homer. No one's ever trusted me before -- except for that one guy who shouldn't have."
Moe Szyslak,"Whoa, whoa, whoa, now wait just a minute. One thing Moe Szyslak has never had is a partner. Nor a wife, a friend, a chum, a casual acquaintance, a pen pal, a parrot, a meaningful conversation, a brief hug or eye contact."
Moe Szyslak,I'm just going to call the suicide hotline now. And they've blocked my number! Oh God!
Moe Szyslak,"Marge, my customers don't like themselves. Therefore, they seek the darkness."
Moe Szyslak,"Look, I like Moe's the way it is, all right? And I ain't changin' it for any dame, skirt, Susie-Q, or face-macer."
Moe Szyslak,"YEAH WELL THE SIGN STILL SAYS ""MOE'S"" / SO ENOUGH OF YOUR GUFF"
Moe Szyslak,"Hey, hold the phone. An English Pub, that just might work."
Moe Szyslak,"Uh... MY BAR COULD BE BRITISH / INSTEAD OF ARM-PITTISH / SO WHY DON'T WE ALL Eh, screw it."
Moe Szyslak,"My first credit card! Wow, the numbers are all bumpy-like."
Moe Szyslak,"Thanks, Freakazoid. I'd just like to say that there's one person to whom I really owe my newfound success: Marge Simpson."
Moe Szyslak,"Marge, sorry to call you so late but I had a great idea: put cutesy signs outside the restrooms that say ""dukes"" and ""dames"" instead of the ones we have now that say ""standups"" and ""sitdowns."" Huh? Tell me honestly, what do you think?"
Moe Szyslak,"Uh yeah, how ya doin' there, Homer? Did you ever pass that G.I. Joe you swallowed?"
Moe Szyslak,"Uh you know, Marge, I've really enjoyed you workin' at the bar."
Moe Szyslak,"Oh, I'm just excited because they're showin' an episode of ""Boy Meets World"" on this flight. Oh no, wait. That's only on flights from Europe. We just get that little plane."
Moe Szyslak,"Okay, time to chase this pig into the sty. Uh Marge, you deserve a man who listens to you. Who respects you. Who understands what a treasure you really are."
Moe Szyslak,"Just say you love me, Marge. Love me like I love you. Please?"
Moe Szyslak,You don't deserve her! You know nothin' about Marge -- what's her favorite food?
Moe Szyslak,"Hot damn, I won! Marge, I swear I'll be the best man you ever had. It's gonna be all flowers and back rubs and how-was-your-day dear and--"
Moe Szyslak,You mean I listened to all your touchy-feely yip-yap for nothin'?
