raw_character_text,spoken_words
Ned Flanders,"Now, throughout history, when people get wood, they'll think of Trojans."
Ned Flanders,"Heaven and earth... Where were we? Oh, now I'm lost."
Ned Flanders,"Well, sir, of course He could... but then again... Wow, as melon-scratchers go, that's a honey-doodle."
Ned Flanders,"Well, luckily, I've got a book right here that's jam-packed with answers."
Ned Flanders,...The grace of the Lord Jesus be with God's people. The End.
Ned Flanders,"Well, I know he's wishin' you'd sign his petition...to re-criminalize medicinal marijuana."
Ned Flanders,"Well, okay... I, I guess it would go something like this: All right, Simpson, you're under arrest, see?"
Ned Flanders,"Hey, hey, now hold on there. The nice people want to hear the real words."
Ned Flanders,"Hey Homer, I've been singing your praises all day. Marge said we could have choir practice in your house tonight."
Ned Flanders,"Here's a preview. GOD SAID TO NOAH / BUILD YOURSELF AN ARK-Y ARK-Y / ANIMALS CAME ON BY ONES AND TWOSIES, TWOSIES / ELEPHANTS AND KANGAROOSIES - ROOSIES..."
Ned Flanders,"Well, nice work, Inspector Find-It. Did you catch the thief?"
Ned Flanders,"I don't know, neighboreenos, I'm all for Halloween fun, but a séance sounds a little PG-13."
Ned Flanders,Maude! You still look as pretty as the day I buried you.
Ned Flanders,"Say Homer, I was, uh, I was wondering if I could borrow that chainsaw you, uh, stole from me."
Ned Flanders,"Hate to be a needy Neddy, but, uh, could you do me a favor...?"
Ned Flanders,"Boy, that's Jim Dandy roof candy! I'd love to come over some time and watch that Church Channel."
Ned Flanders,"Oh, you'd win that bet. Seems like I'm spending all my money on religious pay-per-view. Or as I like to call it, ""pray-per-view."""
Ned Flanders,"Well, cock-a-diddily-doo! What a Marge-alicious way to start my Flander-rific day."
Ned Flanders,"Shop o' the mornin', Homer! Just call me ""Mall"" Flanders."
Ned Flanders,You betcha! This kiosk sells personalized movies. I had one made starring little Rod.
Ned Flanders,"Now Rainier, I really don't think it's right to sell these Playdude centerfolds."
Ned Flanders,You betcha. It's a nice break from the male sports I usually watch.
Ned Flanders,"Oh sure, speed walking, ballroom dancing, rhythmic gymnastics, extreme choir..."
Ned Flanders,"Gosh, fifty thousand dollars? I'm donating this whole check to ""Bibles for Belgians."""
Ned Flanders,"Well, whatever I've got I owe to hard work, honest living, and flossing my teeth, tail and toes. Plus a little prayer now and then."
Ned Flanders,"Homer, please don't sue the church. I'm asking you as your friend and neighbor."
Ned Flanders,"Where you going, Reverend? The town's that way. Reverend? You're goin' the wrong way!"
Ned Flanders,"No, no, you're lying! You're lying! What makes you lie?"
Ned Flanders,"Lord, this town may have turned its back on you, but not the Flanderses. Wherever we are, you'll have your church. Are you with me, boys?"
Ned Flanders,"Okay boys, this is it. The end of this sinful little suburb."
Ned Flanders,"Okay, I've got two of every animal. But only males -- I don't want any hanky-panky. Hey, hey, hey, cut that out!"
Ned Flanders,"Well, Sea Captain, looks like you and I are sailin' solo tonight."
Ned Flanders,"Well, guess I might as well head back to my store. I've got a date with some twins: my state and federal tax forms."
Ned Flanders,"Form of business? Sole proprietorship. ""Owner's marital status?"" Happily married... to a dead woman."
Ned Flanders,"Mm hmm! Open as a tomb on Easter. Now, what can I ding dong diddily do for ya?"
Ned Flanders,"Oh, I should say not. I gave up on L.A. when those TV people made that poor nun fly. All those Puerto Ricans lookin' up her dress. That's not right."
Ned Flanders,Do I! No I don't. But I can have 'em here by Tuesday.
Ned Flanders,"I sure do. You're the most important person in the world, because you're my customer."
Ned Flanders,"A woman askin' a man out? Well, well why not. And maybe I'll eat my steak with a spoon."
Ned Flanders,WELL I'VE GOT A DATE WITH A GIRL WITH NO NAME / IT SURE FEELS GOOD TO BE BACK IN THE GAME / AT DESSERT MAYBE I CAN ASK HER HER NAME / 'CAUSE I CAN'T PRAY FOR HER WITHOUT THE RIGHT NAME...
Ned Flanders,"No, it's Sara Sloane. I have a date with her tonight."
Ned Flanders,Yep. Why would that Twinkie want to go out with a ding dong like me?
Ned Flanders,"Well sir, that's very encouraging but I can't date a movie star. I'm no Arthur Miller or Lyle Lovett."
Ned Flanders,"... Rod says ""Marco,"" and darn it if Todd doesn't say ""Polo"" right back! Oh, listen to me just running my gums about my kids. You're probably bored silly."
Ned Flanders,Heaven's gate! I'm gonna be tastin' you on my mustache for a week.
Ned Flanders,"Yep, we occupy that useless mass of land between Los Angeles and New York. Called America!"
Ned Flanders,"Oh now, if someone took the time to press that little button, this is the least I can do."
Ned Flanders,"Whoa, whoa, whoa, whoa, whoa. This movie's turning into Sponge Bob No-Pants!"
Ned Flanders,"Sir, there's no reason Sara needs to do this scene in the altogether."
Ned Flanders,Yep. Now all we gotta do is turn that woman into a fella and that kiss into a game of Scrabble.
Ned Flanders,Mm-hmm. I haven't felt this good since we stole the 2000 election.
Ned Flanders,The paparazzi! I thought we fooled them with our Cher-crow.
Ned Flanders,I'll have you know she pays full price for all her watercraft!
Ned Flanders,No way! I won't even eat vegetables over two inches long.
Ned Flanders,"So anyway, uh, your movie's wrapping up soon. I guess you'll be headin' out on the first bus to the airport. If you ride with a friend, you can save twenty bucks!"
Ned Flanders,"Sara, I'm sorry, but I can't move to Hollywood. Heck, even Dollywood's too far out for me. Too many people appreciating it ironically."
Ned Flanders,Sure is nice to be shopping for a woman again. The last thing I bought for a lady was a casket.
Ned Flanders,Well of course. Wait a minute. This is to adopt two of your kids.
Ned Flanders,"Hop to it, honey! If we get to the Pops concert early, we can give up our seats to some old people."
Ned Flanders,"Sweetie, that's not the kind of dress you wear outdoors... or indoors... or in a dirty dream."
Ned Flanders,"Well, Siegfried and Roy create a lot of illusions, but I doubt their girlfriends dress like that."
Ned Flanders,"Sara, I hate to say it, but your top's upstaging the Pops!"
Ned Flanders,"Sara, I love ya, but I get the feeling you're just... not a Ned-head tonight. Is something wrong?"
Ned Flanders,"Se... well, that's a mighty big... kettle of... premarital... uh, doodly..."
Ned Flanders,This is quite a dil-diddly-lemma. I better talk this over with the big man.
Ned Flanders,"Well, I'm not sure I want to do it. I mean ""who'll buy the cow when you get the milk for free?"" You know, the cow being me."
Ned Flanders,"Well, I consulted my bible and found some verses supporting what you want to do."
Ned Flanders,It says a man should make restitution if he eats his neighbor's grain. And that's good enough for me.
Ned Flanders,Uh hmm. That's right. I'm like Baskin Robbins. You get one free taste then you gotta buy the scoop.
Ned Flanders,"I love you, too. And I always will. But unlike the Bible, I guess this isn't gonna have a happy ending."
Ned Flanders,"Oh, darn the luck. That sounds like the Lupus Fun Run."
Ned Flanders,You know it's the darndest thing -- women love you when you've dated a movie star.
Ned Flanders,Why don't you pound that sign into your own lawn?
Ned Flanders,And it wouldn't hurt you to put up some curtains.
Ned Flanders,"Ooh, that's quite a thing-a-ma-jigsaw. But it looks like you're missin' a piece."
Ned Flanders,"Uh, Homer, I think you want your house, next door."
Ned Flanders,"Well, the Bible says it's fun to do stuff together."
Ned Flanders,"THERE'S A STRANGER IN THE MANGER AND HIS NAME IS LOVE Take it, Homer!"
Ned Flanders,"Oh, I got it -- you want me to stay out here and work on the chorus."
Ned Flanders,"Why thank you, Homer. It's a popsicle in my favorite flavor -- plain."
Ned Flanders,"THEN I DOUBT YOU'LL LIKE NED FLANDERS / OR HIS CREEPY LITTLE OFFSPRING, ROD AND TODD..."
Ned Flanders,"I got your letter, Jesus and I'm coming as fast as I can."
Ned Flanders,"Well, the folks at the senior center sure will love that peach tree we planted."
Ned Flanders,Scared of what? All the funny camp songs we're gonna sing? WE'LL BE SAFE INSIDE OUR FORTRESS WHEN THEY COME / WE'LL BE SAFE FROM CREEPS AND KILLERS WHEN THEY COME / UNLESS THEY HAVE A BLOWTORCH / OR A POISON GAS INJECTOR / THEN I DON'T KNOW WHAT'LL HAPPEN WHEN THEY COME!
Ned Flanders,Of course I am. They were bigger than Jesus! But your boy went Yoko and broke up my collection.
Ned Flanders,Oh our courts aren't fit to keep children in line. The only thing they're good for is telling women what to do with their bodies. What these boys need is adult supervision.
Ned Flanders,"Well, I did finish first in the Walk For The Cure... of homosexuality."
Ned Flanders,"I'm dying! And there's Heaven. But who's that? Confucius? And Milton Berle? Boy, have I been barkin' up the wrong tree."
Ned Flanders,"Oh well, you snooze you lose. But uh, can I have my photo albums back?"
Ned Flanders,"Well, the hobos sure will appreciate our old clothes and lima beans."
Ned Flanders,"Gee, looks like this town has a good Sam log-jam."
Ned Flanders,HERE COME SANDWICHES / HERE COME SANDWICHES / RIGHT DOWN BOOZY BUM LANE...
Ned Flanders,BROTHER NED'S GOT CHEESE ON BREAD / AND A SIDE ORDER OF SHAME...
Ned Flanders,"Why, I'll give you a jump, I'll rotate your tires, I'll even fold up that map for you. I know they can be a dickens of a doozy..."
Ned Flanders,That tears it. I'll show Homer. I'm gonna be the nicest man this world has ever seen.
Ned Flanders,"My angle is givin' in this world, livin' in the next."
Ned Flanders,"Well, actually, I picked up some extra cash renting out my house to a fraternity."
Ned Flanders,"Friends, what Homer did was wrong. But I've been thinking -- maybe I was just as wrong to give you those gifts."
Ned Flanders,"""And the angel said unto them, Fear not: for, behold, I bring you good tidings of great joy, which shall be to all people..."
Ned Flanders,"Hey Marge, you look like you could use a nice big stud... detector."
Ned Flanders,"They were two for one at Krusty Home Depot, so I got an extra one for you guys!"
Ned Flanders,"Well, some say being thoughtful is old-fashioned. If so, then I guess I'm just a cave man. If they existed, which they didn't!"
Ned Flanders,"Well, I guess it wouldn't kill me to let you in."
Ned Flanders,"Dear Lord, please make Homer's blows precise and deadly with a minimum of pain. Oh, and forgive me for those impure thoughts I had about the girl on the raisin box."
Ned Flanders,...and a backrub can just be a backrub. It doesn't have to lead to adult situations.
Ned Flanders,"Now now, remember why we're here: to celebrate Jasper's birthday."
Ned Flanders,"Huh, credit card bill seems a little chunky this month."
Ned Flanders,Let's see what's goin' on vis a vis the VISA.
Ned Flanders,"Well this is one dilly of a daily, Lisa. Can't wait for tomorrow's!"
Ned Flanders,"Come on, Ned. Just because you foresaw Dr. Hibbert's death doesn't mean you can see into the future. It was just a sinister co-inky-dink."
Ned Flanders,What the Family Circus? A second premonition came to fruition.
Ned Flanders,"Lord, why have you given me these unholy visions of doom?"
Ned Flanders,Well I didn't need any special power to know that was comin'.
Ned Flanders,'Cause I had a vision of myself... shooting your father.
Ned Flanders,"Don't worry, sweetie. I am not going to kill your father."
Ned Flanders,"Homer, please, don't tempt the gods. I-I mean God! There's-there's one God! Only one! Well, sometimes there's three."
Ned Flanders,"I was supposed to shoot you, but I didn't! I changed the future!"
Ned Flanders,What have I done? I've changed the future for the worse.
Ned Flanders,I gotta find Homer -- he's gonna blow up the whole town!
Ned Flanders,I just told the natives they were havin' sex the wrong way!
Ned Flanders,"Marge, you know I thought I was Springfield's wing ding king, but uh, you make my chicken look like cock-a-diddily doo doo."
Ned Flanders,"You know I was gonna enter this here Ovenfresh Bakeoff... but up against you, I wouldn't have a Hindu's chance in Heaven."
Ned Flanders,"Well, my Roddy told a joke about an octopus and a set of bagpipes -- and the punchline implied that they fornicated!"
Ned Flanders,"Let's see... ""Get Bent."" Well, the only thing that could mean is kneel down and pray. We'll take the whole box. Get bent, everyone!"
Ned Flanders,"Help me out, Homer. My little Roddy needs his insulin. Breaks my heart to watch him jones-diddly-ownsing."
Ned Flanders,I was just telling him how brave he is to worship a false god.
Ned Flanders,"Hello, neighborino to the north. I sure like the cut of your gibberish."
Ned Flanders,"Not that convenience store crap, is it? Because I don't feed that to my dogs."
Ned Flanders,"Here, let me wrap this wet towel around your head to cool you off."
Ned Flanders,"Well, I'll just call you friend. Here's your tape... friend."
Ned Flanders,"There's nothing but filth on TV. But with this new video camera, we can make our own entertainment!"
Ned Flanders,"Now boys, we're gonna film the world's first and some would say best murder mystery -- the story of Cain and Abel!"
Ned Flanders,"Your mouth is hopin' for a soapin', boy! Now stop asking silly questions and go kill your brother!"
Ned Flanders,"Boys, I just talked to God. He's vacuuming Heaven to get it ready for when dead people show up. And He'd like you both to render a sacrifice."
Ned Flanders,"Now I must bury my son, while you wander the earth forever, with the mark of evil upon your face."
Ned Flanders,"Now, there's no need to actually whip 'em. We can put the sound in later."
Ned Flanders,"Oh, I-I guess you'd rather see a film about a liberal European wizard school, or the latest sexcapade of Miss Ashley Judd!"
Ned Flanders,"Yeah. I made a great film, but I'm havin' trouble gettin' it out there. I'm like Michael Moore, except I'm skinny, my jeans are washed, and God loves me. I just wish I could find some way to spread my message."
Ned Flanders,Wait a minute -- you've got a medium and I've got a message. Maybe God brought us together for a reason.
Ned Flanders,"""So God blessed Noah and his sons, and said to them... Never again shall there be a flood to destroy the Earth. I set My rainbow in the cloud, and it shall be a sign of the covenant between God and man."" Thank you."
Ned Flanders,"Well now Roddy, the Lord wouldn't let us die this way."
Ned Flanders,"Well, we could use a new H.Q. for the Springfield Philharmonic. They're playing Gustav Mahler in abject squalor."
Ned Flanders,"Sorry, Homer. You'll have to call me a Ray-theist, 'cause I don't believe I saw him."
Ned Flanders,"Gee, I thought my vision was perfect. And here I was, worshiping false eyeballs."
Ned Flanders,"Uh son, we're here to help with your... which addict-a-diddily-diction are we goin' after here?"
Ned Flanders,"Well, well, well, looks like someone's having a pre-Rapture party."
Ned Flanders,"Howdy, Homer. You here for a viewin' of my shampooin'?"
Ned Flanders,"Oh, sorry, but I promised to rewind videotapes for the poor."
Ned Flanders,"Oh-uh-uh... sorry Maggie, that's something to collect, not enjoy. It's one of my Humble figurines."
Ned Flanders,"He scampered out of Parade magazine and into my knick-knack nook, and uh, well his little buddies soon followed."
Ned Flanders,"You like 'em, huh? Come on, I'll show you the other three hundred."
Ned Flanders,"Oh, I can't take money from a neighbor. Although, business at the Leftorium's been pretty slow since that big chain store came to town."
Ned Flanders,"Well, it might be fun to be a landlord. Landfella -- there's only one Lord!"
Ned Flanders,"Well, I'd love to help you out, but you do have to be over eighteen."
Ned Flanders,"Well, I do appreciate that you've got a cashier's check... Now, do you have any pets?"
Ned Flanders,"You poor thing! I've heard about those robes -- flapping everywhere. Girls, welcome to your very own Ned and Breakfast."
Ned Flanders,"Here's your room, ladies. You can catch some Z's while you earn those degrees."
Ned Flanders,I coulda sworn I just heard someone shriek my name.
Ned Flanders,You soft-core sophomores took advantage of my trustful nature. And sullied the internet by putting pornography on it!
Ned Flanders,The whole town is laughing at me behind my back. I guess you're the only real friend I have.
Ned Flanders,"The Bible says ""cast your bread upon the waters."" But all I got was a bunch of soggy bread."
Ned Flanders,"Well, Toddy, you know how I said our friends are like the Canaanites? Today I realized they're more like the Midianites."
Ned Flanders,I wish we lived in a place more like the America of yesteryear that only exists in the brains of us Republicans.
Ned Flanders,"""Made in Humbleton, PA."" I don't usually make big life decisions based on things stamped on things that I bought at a garage sale. But corndog it boys, it's time for a change!"
Ned Flanders,The Flanders family has pulled up stakes. You have laughed at us for the last-diddily-ast time.
Ned Flanders,This town is sweeter than a cake made of pie. Even the dogs curb themselves.
Ned Flanders,"Get rid of Dr. Fuzzenstein? Why, I couldn't dream of thinking about considering..."
Ned Flanders,You know what? I'm not gonna. My mustache has the right to life -- it's my body and my choice!
Ned Flanders,"Homer, that's really touching. But my boys and I are trying to make a new start, and the people here are a little more my cup of..."
Ned Flanders,"That tears it! Boys, put on your goody two-shoes. We're moving back to Springfield!"
Ned Flanders,"So you see Mr. Roberts, I really would like my house back."
Ned Flanders,"Now coach, I've tried to be Christian and respectful, but I guess I'm just gonna have to point out your two hundred thousand dollar check bounced. Legally, I still own this house."
Ned Flanders,It sure is great to look down my nose at everybody again. Mind if I waggle my finger a little bit?
Ned Flanders,"Marge, this calls for an emergency meeting of the church's spiritual council. To Stuckey's!"
Ned Flanders,Bart and Homer can't go Catholic! The Romans have been separate from us since the Schism of Lourdes in 1573. And that was about our holy right to come to church with wet hair. Which we've since abolished.
Ned Flanders,"Oh, we've gotta stop 'em now! Once they seal the deal, there's no turning back. Like the Jews with their snippity-snip."
Ned Flanders,He's right. Can't we all get together and concentrate on our real enemies: monogamous gays and stem cells?
Ned Flanders,"Okily-dokily, here's some French roast, now I'll go make toast."
Ned Flanders,"Hey Homer, why the sour puss? Didja chugalug a skunky Snapple?"
Ned Flanders,Really? Do you mind if I bring my boys over so she can infect Rod and Todd? Then there'll be a pox on both our houses!
Ned Flanders,"Au contraire, man with no hair! You see, Rod and Todd can only get the chicken pox once, and childhood's the safest time!"
Ned Flanders,"You betcha! In fact, some parents have been known to hold ""pox parties,"" so other kids in the neighborhood can get the disease when they please."
Ned Flanders,"Well, they might. But you'd have to be awfully money-grubbing to charge your friends and neighbors..."
Ned Flanders,Please change me back! This bumble bee has developed an unhealthy obsession with me.
Ned Flanders,You want me to deliver the Christmas sermon? I feel like I'm born again again!
Ned Flanders,"Don't be nervous, Ned. You've practiced this so many times in the shower."
Ned Flanders,HOW I LOVE MY COAT OF MANY COLORS / IT WAS RED AND YELLOW AND GREEN AND BROWN / AND SCARLET AND BLACK AND OCHRE AND PEACH / AND RUBY AND OLIVE AND VIOLET AND FAWN...
Ned Flanders,...AND LILAC AND GOLD AND CHOCOLATE AND MAUVE / AND CREAM AND CRIMSON AND SILVER AND ROSE / AND AZURE AND LEMON AND RUSSET AND GREY...
Ned Flanders,AND PURPLE AND WHITE AND PINK AND ORANGE / AND RED AND YELLOW AND GREEN AND BROWN / SCARLET AND BLACK AND OCHRE AND PEACH...
Ned Flanders,"Hey Marge, I don't I don't really want a computer. You know all those complete strangers Googling each other. Makes my flesh crawl."
Ned Flanders,"Well sir, we could do a little Quid Pro for the Kay-Pro. The left-handed convention is in town, and as the owner of Springfield's largest southpaw shop, I just gotta be there. Could you uh, nanny-goat my kid-diddly-ids?"
Ned Flanders,"I'm so glad you're watchin' the boys, Marge. Our last babysitter let 'em watch ""Comedy Central"", now Rod makes me check the closet every night for Rita Rudner."
Ned Flanders,"Here are the numbers for the police, fire, ambulance, poison control, burn clinic, and people nearby with Rod and Todd's blood type."
Ned Flanders,"Ooh, wow, it's the Big Unit himself, Randy Johnson! You've fanned more men than Salome!"
Ned Flanders,Hiya Marge. Rod and Todd in the land of nod?
Ned Flanders,"Hey, you're welcome to see the dynamic duo any time."
Ned Flanders,"It's the ripcord from a Band-Aid wrapper! Call me Ned Zeppelin, but is one of my boys abrased and contused?"
Ned Flanders,"Well, I think it's about time you boys get to bed."
Ned Flanders,"And so we don't have another disaster, you crawl up those steps!"
Ned Flanders,I just can't. They're all I've got since that sad day when Maude found eternal happiness.
Ned Flanders,"Well, their mascot is a kneepad wearing a helmet... why not?"
Ned Flanders,"I'm not Ned, I'm a friendly dog. Oh, I'm not a good liar. I did come here to check on the... where's Rod?"
Ned Flanders,He chipped a tooth! How will he bite Wheat Thins? How?
Ned Flanders,"WELCOME TO THE JUNGLE GYM / I'LL MAKE IT SAFE AGAIN / WHEN PLAYTIME IS A SAFE TIME, EVERYBODY WINS..."
Ned Flanders,NOW I'LL LAY DOWN SOME ASTRO TURF / SO THEY DON'T SCRAPE THEIR N-N-N-N-N-N-N-N-KNEES...
Ned Flanders,"Well, we're gonna do what every kid your age likes to do: look at bread."
Ned Flanders,"Uno?! That's a gateway game to pinochle. All diddily aside, boys, what is it about her you miss so much?"
Ned Flanders,"Rod... You can do it, boy! With God on your side, you can't fail!"
Ned Flanders,"Lord, with you watching over me I shall feel no pain."
Ned Flanders,"Only ten dollars to paint my curb like a common whore? Well I'm happy to pay for a three-digit spray! Tell you what, I'll give you another hundred if you paint my garage!"
Ned Flanders,"Tell you what -- if we turn around, it'll feel like we're at the front of the line!"
Ned Flanders,"You're leavin' already? We, we haven't even gotten in yet."
Ned Flanders,Excuse me. How can you put up an exhibit on the origin of man and not have one mention of the Bible?
Ned Flanders,No one was ever a monkey! Everything is what it was and always will be! God put us here and that's that!
Ned Flanders,They're telling people we're descended from a pack of apes. Even though there's nothing about it in the Bible!
Ned Flanders,We want you to teach alternative theories to Darwinian evolution.
Ned Flanders,As sure as I am that Jesus hates Hip Hop!
Ned Flanders,"Well, I wish this world would evolve a few more kids like you, Lisa."
Ned Flanders,What say we take our worthy adversary out for a hot fudge fun-day?
Ned Flanders,"I... uh... I got your phone bill in my mail by mistake... and, uh... I'll just pay it."
Ned Flanders,"Marge, I hate to interrupt the ol' solilo-diddly-iloquy, but I just want to thank you for your early Christmas card."
Ned Flanders,"Oh I don't mean to cause Gil ill will, but still..."
Ned Flanders,"Tonight's G-rated gem is a silent film from my favorite year -- yester! And while you enjoy this quiet riot, I'll be slipping these religious pamphlets on your windshields."
Ned Flanders,"He's the kindest, sweetest most generous man ever to drive through my living room."
Ned Flanders,"Oh, I wish! No, these are complimentary boxes from the shipping company."
Ned Flanders,"Only if he fibbed about his name, age, and occupation on this automated eight-hundred number."
Ned Flanders,Why don't you put this box by your phone so you don't call the number by accident.
Ned Flanders,"This is it, boys -- One more out and we go to the championship game. Let's do it for Groundskeeper Willie... who made me this beautiful black bicep warmer!"
Ned Flanders,"Now Bart, stay humble! Your baseball cap won't fit over a swelled head."
Ned Flanders,"A damp sponge will take care of this weak, water-based... it's oil-based! Oil-based!"
Ned Flanders,"Okay, ""Smallville""... super dog licks himself. That definitely goes in the naughty pile!"
Ned Flanders,"Sixty Minutes -- Morley Safer has questionable pants fold -- ""The L Word"" -- used the ""L"" word."
Ned Flanders,Imploring people I never met to pressure a government with better things to do to punish a man who meant no harm for something nobody even saw. That's what I'm doing!
Ned Flanders,So it is! I'm just here to pay the fine for the Sunday School bus. You towed it with the kids still in it!
Ned Flanders,"You know what they say: ""With great power comes great responsibility."""
Ned Flanders,I've got something that will scare the H-E-double sippy straws out of them.
Ned Flanders,Welcome to Heck House! You're about to discover what a life of sin will get you!
Ned Flanders,"No, the lesson here is he's being punished for thinking women are beautiful."
Ned Flanders,"Please, Lord, grant me the power to psychologically torture them into loving you."
Ned Flanders,Springfield is rife with the seven deadly sins! Starting with... GLUTTONY!
