raw_character_text,spoken_words
Ned Flanders,"Hey, anybody mind if I serve as bartender? You know, I have a Ph.D in Mixology."
Ned Flanders,"Hey, Homer! Care to try some of my Flanders Planters punch?"
Ned Flanders,"Au contraire, Simpson! It has three shots of rum, a jigger of bourbon and just little dab-a-roo of creme de cassis for flavor."
Ned Flanders,"Why, Homer Simpson! Here to give your marriage a little spit shine?"
Ned Flanders,"Sometimes Maude, God bless her, she underlines passages in my Bible because she can't find hers."
Ned Flanders,"Why Homer, you silly goose! The weed whacker's just for the edges! You're gonna be out here all day!"
Ned Flanders,"You are a picture and a half! Well -- hee hee! -- if you're finished by tomorrow, come on over and strap on the feed bag. We're gonna fire up old Propane Elaine and put the heat to the meat! Nummy nummy num!"
Ned Flanders,Fee fi fo fum! I smell the potatoes au gratin of Marge Simp-son! Mmmm- mmm!
Ned Flanders,"Friends, we love you all, but I also have a ""sinister"" motive for asking you all here -- ""sinister"" being Latin for ""left-handed."" But enough joking."
Ned Flanders,"As of Friday, I'm saying toodle-oo to the pharmaceutical game."
Ned Flanders,"No, I kid you not. Here's the noose I had to wear for ten years."
Ned Flanders,"Well sir, like one out of every nine Americans, I'm left-handed. And let me tell you, it ain't all peaches and cream. Your writing gets smeared. Lord help you if you want to drive a standard transmission."
Ned Flanders,"Well sir, I'm opening a one-stop store for Southpaws. Everything from left-handed apple peelers to left-handed zithers. I'm gonna call it the Leftorium."
Ned Flanders,"So Homer, I'm dyin' to know. What do you think of the Leftorium?"
Ned Flanders,"Well, I know it's a little risky and it's gonna be a lot of hard work, but gosh darn it, it's gonna be a lot of fun, too."
Ned Flanders,"You must have something you want to wish for, Homer."
Ned Flanders,"Come on, Homer! I got an ambition to do some wishin'!"
Ned Flanders,"No, no, no, don't say. Otherwise it won't come true."
Ned Flanders,"Oh, a little pokey, but things are gonna pick up."
Ned Flanders,"Now, you put that money away. That was an accident."
Ned Flanders,N-Not yet. But one of the mall security guards took a good long look at a left-handed ice cream scoop.
Ned Flanders,"Oh, oh, oh, I expect things to start picking up soon. I think word of mouth is startin' to spread."
Ned Flanders,"Oh, right as rain. Or, as we say around here, left as rain."
Ned Flanders,"Come on, Homer. Tell him about the store. I'm dyin' out here."
Ned Flanders,Are you sure you're not interested? Two hundred dollars is only the asking price.
Ned Flanders,"Hey, I'm flexible! You don't have to pay all at once. I'll be here all night if you change your mind."
Ned Flanders,"Oh, yeah. Sure. Thought I'd just get rid of some of the clutter. See anything you like?"
Ned Flanders,"Ah, got your eye on the gas grill. She's a butane beaut."
Ned Flanders,"Twenty? Homer, I paid three hundred dollars for this just last year."
Ned Flanders,"Well, there's no house to put it in, Homer, not since that nice fellow from the bank, who was only doing his job, came and locked it up."
Ned Flanders,"Oh, oh, no, it's just a little campout tonight, then off to my sister's apartment in Capital City. Hey what do think, kids? The big city!"
Ned Flanders,"Say, Todd, I want to talk to your Uncle Homer. You're head of the car till I get back."
Ned Flanders,"Listen to that singing... those poor fools. Homer, I'm ruined."
Ned Flanders,"You know at times like these, I-I used to turn to the Bible and find solace. But even the good book can't help me now."
Ned Flanders,"You know, ever since that barbecue, nothing's gone right. It's like there's been a-a curse on me."
Ned Flanders,"No! You tried to warn me about gambling my family's future on some pig in a poke... I didn't listen. Homer, you were a true friend."
Ned Flanders,For two more days. Then it becomes Libertarian Party headquarters. I hope they have better luck than I did.
Ned Flanders,"Homer, affordable tract housing made us neighbors. But you made us friends."
Ned Flanders,"Hey, fellow slave, is that one of those monkey paw dealies that lets you wish for things?"
Ned Flanders,"Well, I guess my first wish is to get rid of those awful aliens."
Ned Flanders,"Hey, Homer! This little thing-a-ma-jig really works great. Now that I've saved the earth, maybe I oughtta spruce up the ol' homestead."
Ned Flanders,"Fella came into the store today and asked for change for a dollar. Well sir, I gave him three quarters by mistake. Took me the whole afternoon to track him down."
Ned Flanders,"All right, that's it, young man. No Bible stories for you tonight."
Ned Flanders,"Well, you knew I had a temper when you married me."
Ned Flanders,"Sorry to bother you, Reverend Lovejoy, but I'm kind of in a tizzy. Our son Todd just told us he didn't want to eat his ""damn vegetables."""
Ned Flanders,"No Reverend, the point is, he said a bad word."
Ned Flanders,"He's not getting it from his brother, that's for darn sure."
Ned Flanders,I'm afraid I have a bone to pick with you.
Ned Flanders,"No, I-I came to talk to you about your potty-mouth."
Ned Flanders,"Look Homer, all of us pull a few boners now and then... go off half-cocked and make asses of ourselves. So, I don't want to be hard on you... but I just wish you wouldn't curse in front of my boys."
Ned Flanders,"Okay, mister, you've got yourself a deal. I'll shave off the soup strainer, if you give the sailor talk the old heave-ho, okay?"
Ned Flanders,"Hey Homer, Ya know, I owe you one, buddy. No sooner had I shaved off the old cookie duster, than a lady cast me in a commercial."
Ned Flanders,"Ah, I tell ya the way these checks keep coming in, it's almost criminal."
Ned Flanders,... So recycling is our way of giving Mother Earth a great big hug.
Ned Flanders,Aren't we in luck? Today's our tithe day and we've got ourselves a transient. Come in my friend. Let us feed and bathe you.
Ned Flanders,"Well, if you ever want to spend the night, Maude and I can sleep on card tables."
Ned Flanders,"Oh, indeedily-doodily. I've even been in ""Streetcar"" once before. I played Blanche DuBois! Hmmm huh. Just part of the fun of going to an all-male school."
Ned Flanders,"Hot diggity! How 'bout that, Marge? Li'l ol' Stanley me! ""Stella!"" ""Stella!"" Heh heh."
Ned Flanders,"Here, Marge, let me. Hate to be an armchair Blanche, but I always gave it one of these..."
Ned Flanders,STELLA! STELLLA! CAN'T YOU HEAR ME YELL-A? / YOU'RE PUTTIN' ME THROUGH HELL-A / STELLA! STELLA!
Ned Flanders,The door's frozen shut... and it's the only way out!
Ned Flanders,"Neighbor, I heard about your heresy and we've made it our mission to win you back to the flock."
Ned Flanders,"Homer, Christian life isn't all praying and sacrifice. Hey, dig this."
Ned Flanders,"Dear Lord, may your loving hand guide Homer to the mattress square and true."
Ned Flanders,"Why, Sue Dokes, you rascal! I thought you were dead and--"
Ned Flanders,"Howdy-do, neighbor! Good pipe weather. Thought I'd fire up the briar."
Ned Flanders,"Buenos dias, neighboritos. The handle's Flanders, but my friends call me Ned."
Ned Flanders,I just this minute bought it at the hardware st...
Ned Flanders,"We'll take good care of your boy, Simpson. Enjoy the miracle of creation."
Ned Flanders,"Oh Bart, you met Grandma Flanders. Hope she didn't scare ya."
Ned Flanders,"Heidy-ho, Simpson. Your son shoved this through our doggie door."
Ned Flanders,"And since we're returning your second born, do you think you could see your way to returning my TV tr..."
Ned Flanders,"Homer Simpson! Well, if that don't put the ""dink"" in co-inky-dink."
Ned Flanders,"If I could give you my heart, Homer, I would."
Ned Flanders,"Dear Lord, thank you for Ziggy comics, little baby ducks, and ""Sweatin' to the Oldies,"" Volumes One, Two and Four."
Ned Flanders,"IF YOU THINK I'M CUDDLY / AND YOU WANT MY COMPANY / COME ON WIFEY LET ME KNOW... UGH, UGH, UGH... OOOH..."
Ned Flanders,It's been four thousand days since my last drink. It was my first and last Blackberry schnapps.
Ned Flanders,"Hi-ho pagans! New Years was three months ago, but here's a present anyhoo!"
Ned Flanders,"I wish he were, Rod, I pray for the day, but I'm afraid he's just delirious from fever."
Ned Flanders,I can't imagine what we could've done to... Oh... oh no!
Ned Flanders,Oh...the network slogan is true. Watch Fox and be damned for all eternity.
Ned Flanders,"Now, Marge, don't you worry. We've all had our brushes with the law."
Ned Flanders,"Well, boys, who'd have thought learning about religion could be fun?"
Ned Flanders,... 'cause the schools can't force you like they should.
Ned Flanders,"Maude, these new finger-razors make hedge trimming as fun as sitting through church."
Ned Flanders,"Uh-oh. Better cancel that dinner party tonight. Thanks for the nose-news, neighbor."
Ned Flanders,"Aww, isn't that cute? He's trying to claw my eyes out."
Ned Flanders,"Hey now, Marge. Let's not ""should"" this fella to death."
Ned Flanders,"Well it's Bart Simpson! C'mon in! You're just in time for ""Sponge Bath the Old Folks Day!"""
Ned Flanders,"Now, just breathe into him every three seconds. Make sure you form a tight seal around his mouth."
Ned Flanders,"Well sir, just apply a smidgen of peanut butter to an ordinary pine cone and you got yourself a makeshift bird feeder, sir."
Ned Flanders,"Oop, sorry, Bart, that's a Neddy no-no. You're not allowed to handle a pocketknife 'til you read this booklet on knife safety and pass a test."
Ned Flanders,"Here you go, your rubber training knife. You've attained the rank of Pussy Willow."
Ned Flanders,"Okay, kids, now I'm gonna teach you how to trap wild animals. But this should only be used in a life or death situation."
Ned Flanders,"Okilly dokilly. Now, our annual Father-Son Rafting Trip is next weekend."
Ned Flanders,"Oh Warren, I know your Dad is in prison, but don't you fret. A special Celebrity Dad has been arranged for ya."
Ned Flanders,"Sorry, but I'm afraid Ernest Borgnine has already been confirmed."
Ned Flanders,"Okey-dokey, everybody find a partner. Two dads to a raft."
Ned Flanders,"Well, Homer, looks like we're boat buddies, huh? Want me to Zinc your sniffer?"
Ned Flanders,"I guess now we know why they call them rapids and not slow-pids, huh?"
Ned Flanders,Now what happened to that gosh darn map I brought?
Ned Flanders,"Again? Homer, we have to ration the water carefully. It's our only hope."
Ned Flanders,"Wrong, we're saved! Sea gulls always stay near land. They only go out to sea to die."
Ned Flanders,Here's our chance! Dolphins always help humans lost at sea.
Ned Flanders,"Come back! Come back! Oh, we're done for! We're done for! We're Done-diddily-done for we're done- diddily-doodily done-diddily-doodily done-diddily-doodily done-diddily-doodily..."
Ned Flanders,"You know, Homer, this cheese doodle is our last morsel of food."
Ned Flanders,"That's what you're smelling, Homer! Oh, if it weren't for this blasted fog, we'd be saved!"
Ned Flanders,"Homer Simpson! That's a dilly of a pickle. Hey, let's conference you with Marge, huh?"
Ned Flanders,You folks got robbed too? The burglar took my Shroud of Turin beach towels.
Ned Flanders,"Welcome, neighbors... since the police can't seem to get off their dufferoonies to do something about this burglarino, I think it's time we start our own neighborhood watch... arooni!"
Ned Flanders,"I don't really have very much experience, but I'll be---"
Ned Flanders,"Oh golly, if that doesn't put the shaz in shazam. Oh listen, what's the cash value of those tickets so I can report it on my income tax?"
Ned Flanders,"Hidilly ho, neighbor. Wanna go to the game with me? I got two tic..."
Ned Flanders,"Well, get out the Crayolas and color me tickled pink! Oh, what's with the lead pipe? Were you gonna give my noggin a floggin'?"
Ned Flanders,"Stan, tell you what -- Homer Simpson here is just about the biggest Atom fan that's ever graced God's green earth. I bet he'd enjoy it, even more than me."
Ned Flanders,"Ooo, I guess it's time for me to duck again."
Ned Flanders,"Heydilly ho, window buddy. Just wonderin' if you'd like to come over and give the new pool table a whirl."
Ned Flanders,"Uh, be careful there, Homer. That is sort of a new table."
Ned Flanders,"Now, boys, Mr. Simpson is the guest. He gets to decide what to watch."
Ned Flanders,Sure didilly do. Over two hundred and thirty channels locked out.
Ned Flanders,Wait a second. You're the man at the hospital who reads to sick children.
Ned Flanders,"...Bless the grocer for this wonderful meat, the middlemen who jacked up the price, and let's not forget the humane but determined boys over at the slaughter house."
Ned Flanders,"Homer, I-I'd love to chitty-chat, but tonight's the night I do my charity work."
Ned Flanders,"Homer, maybe you'd have had more fun at Moe's tonight."
Ned Flanders,"Sometimes to keep from hurting someone's feelings, we have to say things that aren't exactly..."
Ned Flanders,"Eh, well sir. My entire family is very touched and--"
Ned Flanders,We're headin' back. Todd's got Zesty Italian in his eye.
Ned Flanders,"Oh Lord, please give me the strength to endure Homer Simpson's friendship."
Ned Flanders,There's Homer. There's Homer too. That's also Homer. That's Homer.
Ned Flanders,"Ah, uh, Homer, we're gonna visit the boys' grandmother. Family only. You know?"
Ned Flanders,"I told you, officer. I'm not ""hepped up"" on ""goof balls."""
Ned Flanders,"I can't do it, Maude. I can't face their accusing eyes."
Ned Flanders,"Oh can't you see this man isn't a hero! He's annoying. He's very, very annoying!"
Ned Flanders,"Thank you. Thank you so much, Homer. You really are a you're a true friend."
Ned Flanders,"Well, tippity-top o' the a.m. to every-good-body here! As chairman of the PTA, I Am dee-diddily-lighted to take over, and I think I can put the ""pal"" back in principal."
Ned Flanders,Now I know everybody's eager to get back to class --
Ned Flanders,But I thought it might break the ice if we had a little Q and A.
Ned Flanders,"Well, let me just say I want to put the ""stew"" back in students."
Ned Flanders,"Bart, I've barely been here a good solid week, and you've been sent to my office eleven times. And now that I have peanut butter cups, you seem to be gettin' in trouble every hour."
Ned Flanders,"Anyhoo, Bart, you're gonna have to be punished. This isn't just some sort of club house."
Ned Flanders,"Well, I may go a little bit easy on the old hickory dickory stick, but that's, that's because my dad was so hard on me when I was a boy."
Ned Flanders,"Well, cockily-Doodily-Doo, little buddies. Let's thank the Lord for another beautiful school day."
Ned Flanders,"Well, I really enjoyed my time here, Superintendent. May the Lord bless and keep you."
Ned Flanders,I wish there was some other explanation for this. But there isn't. I'm a murderer! I'm a murderer!
Ned Flanders,MARY HAD A LITTLE LAMB / LITTLE LAMB / LITTLE LAMB...
Ned Flanders,"All right. It's true. I am a murderer. I over-watered Maude's favorite ficus plant, I panicked, and then I buried the remains. I was hoping to replace it before you got home."
Ned Flanders,"Hey, why that sounds like Gabriel's trumpet. You know what that means, kids?"
Ned Flanders,"Oh, I see by the big board we've got a Negative Nellie in Sector Two. I'm afraid I'm going to have to ask the whole family to kinda freeze and prepare for re-Neducation."
Ned Flanders,"Now, in case all that smilin' didn't cheer ya up, there's one thing that never fails. A nice glass of warm milk, a little nap, and a total frontal lobotomy."
Ned Flanders,"I kinda figured this might happen, so I built the shelter big enough for both our families."
Ned Flanders,"Well, Howdilly doodilly neighbors. Shouldn't you be in your sheltereenees by now?"
Ned Flanders,"I may regret this when our air runs out and we can't whistle or stay alive, but oh, what the hey..."
Ned Flanders,"Well sir, sounds fair. Toodle-oo, everybody. I'll, I'll scream when the comet gets here."
Ned Flanders,"I might go mad with fear out there, so Todd, I want you to shoot Daddy if he tries to get back in."
Ned Flanders,"QUE SERA, SERA / WHATEVER WILL BE, WILL BE / THE FUTURE'S NOT OURS TO SEE..."
Ned Flanders,"WHEN I WAS JUST A LITTLE GIRL / I ASKED MY MOTHER WHAT WILL I BE / WILL I BE PRETTY, WILL I BE RICH? / HERE'S WHAT SHE SAID TO ME..."
Ned Flanders,Is that so? Well gee... maybe the old FlandersMobile could use a...
Ned Flanders,Lucky I always keep a Bible close to my heart.
Ned Flanders,Lucky I was wearing an extra large piece of the True Cross today. I think I'll go inside.
Ned Flanders,"Now, Maude, in our movie, you lay baby Moses in the basket, then put it among the reeds. Okay? Lights, camera, act - diddily-doddily-doodilly- Action Jackson!"
Ned Flanders,"Flanders to God, Flanders to God! Get off your cloud and save my Todd."
Ned Flanders,"""'Zounds"" is a renaissance English word, short for ""God's Wounds."" But uh, ""smite-ly,"" that's pure Flanders!"
Ned Flanders,"Oh, we sure could use a pooch to guard the flock at the Flanderosa."
Ned Flanders,"All right, I'd like to call this meeting of the PTA to or-diddly-order and let's see if we can't put an end to this strike fuss, huh? Mrs. Krabappel, why don't you begin?"
Ned Flanders,"Well, I guess this is a case where we'll have to agree to disagree."
Ned Flanders,We do have an emergency plan in case of a prolonged strike right here.
Ned Flanders,"Let's see. ""Replace teachers with super-intelligent cyborgs. Or, if cyborgs aren't invented yet, use people from the neighborhood."""
Ned Flanders,"Bringing in the sheaves, bringing in... Oh my Lord!! Something horrible has happened!"
Ned Flanders,"Well, I guess I am putting up the Halloweenie decorations a little early. Criticism accepted."
Ned Flanders,"Okay, okay folks, look. I called the Police Captain in Shelbyville. He says he hasn't seen our kids, but if they show up in the morgue he's gonna fax us."
Ned Flanders,"Well, okay, but, you know, just go a little bit easy on the..."
Ned Flanders,"Well, a friendly Springfield hello there, neighbors. I, you know, we think some kids of ours may be missing in your town."
Ned Flanders,Mmm-hmm. All we want to do is give you kids a good home until they get their act together.
Ned Flanders,"Oh, Bart. I know you're still getting adjusted here. Tell you what. We'll do whatever you want to do."
Ned Flanders,"Well, I guess a little television won't hurt. I used to let the boys watch ""My Three Sons,"" but it got 'em all worked up before bedtime."
Ned Flanders,"C'mon, you Gloomy Gusses. Who's up for a big bowl of non-fat ice milk?"
Ned Flanders,"WELL, I DON'T KNOW IF THE ALLEGATIONS ARE TRUE / BUT YOU GOT US, AND BABY, WE GOT YOU."
Ned Flanders,"Well, children, it's Saturday night, so what say we let our hair down and play Bombardment..."
Ned Flanders,Okay. For one gold star: What Persian king exempted the Levites from taxation?
Ned Flanders,"No, Son, we've got to let Bart and Lisa get one. C'mon, this one's easy."
Ned Flanders,"Well, guess! Book of Revelations... Fire-breathing lion's head... tail made out of snakes... Who else is it gonna be?!"
Ned Flanders,Jes... ? Jes... ? Don't you kids know anything? The serpent of Rehaboam? The well of Zohassadar? The bridal feast of Beth Chadruharazzeb?
Ned Flanders,Reverend... Emergency... I... You... Simpson kids... Eedily... Baptism... Oodily... Doodily-doodily...
Ned Flanders,"Until this, I never thought Homer and Marge were bad parents. But now I know you kids need a less hellbound family."
Ned Flanders,Today we write a new page in the Flanders family bible.
Ned Flanders,Who wants to be the first to enter God's good graces?
Ned Flanders,"Rod, you order anything you want for your big ten-oh."
Ned Flanders,"Well, I expect that type of language at Denny's, but not here."
Ned Flanders,"Oh, gosh, Homer, this is strictly a Flanders affair. I've got family here from around the globe! Here's José Flanders..."
Ned Flanders,"Congratulations, Homer. Your Q is a huge success. A toast to the host who can boast the most roast."
Ned Flanders,"Well, as the tree said to the lumberjack -- I'm stumped."
Ned Flanders,Yeah. A crazy guy shot a bunch of people and the subway ran over my hat.
Ned Flanders,"You have our deepest condol-diddly-olences. I'm sorry. I'm just nervous, I didn't mean any disrespect."
Ned Flanders,"Oh, Marge. Of course Homer's alive. He's alive in all our hearts."
Ned Flanders,"So if you're looking for a half bag of charcoal briquettes, or an artificial Christmas tree -- trunk only, c'mon over to the Hibbert table. Pronto."
Ned Flanders,"Well sir, looks like we got some nice items here at Table Glick. Like this..."
Ned Flanders,"Uh-huh. Well, I... uh, I guess you could put a lot of nice things in there--"
Ned Flanders,"Now, folks, nothin' spells fun like rhinestones on a dungaree jacket!"
Ned Flanders,"Well, sir, I'm welcoming the Bushes on behalf of the Neighborhood Association."
Ned Flanders,"Howdily-Doodily there, President Bush--or should I say President Neighbor! I'm Ned Flanders, and this is Maude, Rod and Todd."
Ned Flanders,"Thankily-dank, Mayor, I shan't disappoint. Har ye, har ye! I declare myself pickled tink about Springfield's Bicen-ciddily-ti-ten-toodily-rin-tin-tennial Day!"
Ned Flanders,"Aw, they're just family heirlooms. That shouldn't stand in the way of Homer takin' my job and--"
Ned Flanders,"Howdy, Reverend Lovejoy. Nice to see you there ... on my lawn... with your dog."
Ned Flanders,"Better get the ol' snow shovel back from Homer, huh?"
Ned Flanders,Why don't you freeze it with an ice cube and hit it with a hammer? Works for me when I get bubbly-gum in the ol' push-broom.
Ned Flanders,Hmm. I seem to have mashed more hair into it. Oh well.
Ned Flanders,"Well, howdilly-doodily, stranger! Couldn't help but notice you stealing my boat."
Ned Flanders,"Ooh, sounds spine-tingly-dingling. Just promise you'll have a good time."
Ned Flanders,Maude? Boys? Come on up! We're gonna have a little camp-out in the dinghy.
Ned Flanders,"Open the door, Maude! I don't have time for the secret knock!"
Ned Flanders,"Well, now realistically, Homer, I've lived here some 30-odd years. This is the first and only bear I've ever seen."
Ned Flanders,"Homer, I'm in a rhubarb of a pickle of a jam here. I was all set to go off on vacation, when I get called up for jury duty. Oh, it's a corker of a case -- seems a man drove up onto a traffic island and hit a decorative rowboat full of geraniums."
Ned Flanders,"Well, if it'll seal the deal, I'll take a look at your septic tank. See if I can get her hummin' again."
Ned Flanders,"Uh... Homer... Ah, about those things you borrowed from me over the years -- you know -- the TV trays, the power sander, that downstairs bathtub... you going to be needing those things in Cypress Creek?"
Ned Flanders,"Well, if God didn't make little green apples -- it's Homer Simpson! How long have you been here?"
Ned Flanders,"Oh, suckin' down the cider, eh? Hey, word to the wise... season pass!"
Ned Flanders,"Pays for itself after the 16th visit. You know, most people don't know the difference between apple cider and apple juice. But I do. Now here's a little trick to help you remember..."
Ned Flanders,"If it's clear and yellow, you've got juice there, fellow! If it's tangy and brown, you're in Cider Town! Now there's two exceptions, and it gets kinda tricky here..."
Ned Flanders,"...Adirondack cider can be yellow if they're using late-season apples. And, of course, in Canada the whole thing's flip-flopped..."
Ned Flanders,"Homer, I'm as permissive as the next parent. I mean, just yesterday, I let Todd buy some Red Hots with a cartoon devil on the box. But you can't possibly think it's appropriate for your ten-year-old son to work in a burlesque house!"
Ned Flanders,"Uh, it's an angry mob, ma'am. Could you step outside for a twinkle while we knock down your house?"
Ned Flanders,"I'm sorry, it really was one of those spur-of-the-moment-type things."
Ned Flanders,"Y'know, I like his films, except for that nervous fella who's always in 'em."
Ned Flanders,"Well, need some help there? You know, maybe you folks should come over and hunker in our bunker."
Ned Flanders,"Oh, it'll be fun. We're gonna go through our old cancelled checks and receipts and give ourselves an audit. Make sure we don't owe anything extra."
Ned Flanders,"Okilly-dokilly. Oo, I better go take down the manger scene. If baby Jesus got loose, he could really do some damage."
Ned Flanders,"Well, sir, everyone's alive. Guess that's something to be thankful for."
Ned Flanders,"Y'know, it's kinda funny. The only thing that survived the storm were the family tombstones. They're all we have left."
Ned Flanders,"Reverend Lovejoy, with all that's happened to us today -- Uh, I... I kinda feel like Job."
Ned Flanders,"But Reverend, I need to know. Is God punishing me?"
Ned Flanders,"Even in my darkest hour, I can turn to the Good Book for..."
Ned Flanders,"Why me, Lord? Where have I gone wrong? I've always been nice to people. I don't drink or dance or swear. I've even kept kosher, just to be on the safe side. I've done everything the Bible says, even the stuff that contradicts the other stuff. What more could I do? I... I feel like I'm coming apart here. I want to yell out, but I... I... I just can't dang-diddily-do-dang-do-don-diddily-darn-do it. I... I...I..."
Ned Flanders,"It's wonderful. I... I... I don't know how I can possibly repay you, but if any of you ever need a favor, just look for the happiest man in Springfield."
Ned Flanders,"Was that... uh, was that toilet always next to the refrigerator?"
