raw_character_text,spoken_words
Ned Flanders,"Oh, now, calm down Neddilly-diddily-diddily-diddily-diddily... They did their best... Shoddily-iddily-iddily-diddily... Gotta be nice... hostility-ilitity-bility-dility -- Aw, hell, diddly-ding-dong-crap! Can't you morons do anything right?!!"
Ned Flanders,"Well, my family and I can't live in good intentions, Marge! Oh, your family is out of control, but we can't blame you, because you have goooood intentions."
Ned Flanders,"Oh, okay ""Dude."" I wouldn't want you to have a cow, ""Man."" Here's a catch-phrase you better learn for your adult years: ""Hey, buddy, got a quarter?"""
Ned Flanders,Do I hear the sound of butting in? It's gotta be little Lisa Simpson -- Springfield's answer to a question no one asked!
Ned Flanders,"What do we have here? The long, flabby arm of the law. The last case you got to the bottom of was a case of Mallomars."
Ned Flanders,"Oh yeah, the clown. The only one of you buffoons who doesn't make me laugh. And as for you -- I don't know you, but I'm sure you're a jerk."
Ned Flanders,"Homer, you are the worst human being I have ever met."
Ned Flanders,I attacked all my friends and neighbors just for trying to help me. I'd like to commit myself.
Ned Flanders,"Uh, actually, I'm a little chilly. Could I have another straitjacket?"
Ned Flanders,"Oh, well, I'll just have to try harder! Oops, thanks for dropping by."
Ned Flanders,"Oh, they hum like angels. You're never lonely if you've got a fluorescent light."
Ned Flanders,"No, that's not true. I... I... I don't like the service at the post office. Y'know, it's all rush, rush, get you in, get you out. Then, they've got those machines in the lobby. They're even faster. No help there. You might even say I hate the post office. That, and my parents. Lousy beatniks! Hey, that felt good!"
Ned Flanders,"Thanks, everyone. I'm all better now. No more storing up the anger 'til I explode. If any of you does something I don't like, you are gonna hear about it!"
Ned Flanders,"And if you really tick me off, I'm gonna run you down with my car!"
Ned Flanders,"Oh, I admit it! It's only two-alarm -- two-and-a-half tops! I just wanted to be a big man in front of the kids."
Ned Flanders,"Uh, were you on my roof last night, stealing my weathervane?"
Ned Flanders,"THEY'RE NOT PERFECT, BUT THE LORD SAYS LOVE THY NEIGHBOR --"
Ned Flanders,"Homer, I can honestly say that was the best episode of Impy and Chimpy I've ever seen."
Ned Flanders,"Homer, I've got a fozzie of a bear of a problem. Y'know, Maude and her mother were visiting Tyre and Sidon, the twin cities of the Holy Land. They must've kneeled in the wrong place and prayed to the wrong God, because, well, they're being held prisoner by militants of some sort."
Ned Flanders,"Well, any hoodily-doodle, the embassy says it's just a routine hostage-taking -- but I have to drive to Capital City, fill out some forms to get 'em out. Could you possibly watch the kids tonight?"
Ned Flanders,"Well, I don't know, Lisa. You're awfully young, and the boys can be a handful. Todd's been pinching everyone lately."
Ned Flanders,"Well, what do you say, Homer? Can Lisa babysit for my kids?"
Ned Flanders,"Oh, imagine that -- sleeping quietly after a bug attack! Oh, and Todd's as dry as a bone! Lisa, you're a wonder! I'm going to recommend you to everybody!"
Ned Flanders,You did? Just a minute. What time can you come over?
Ned Flanders,"Well, if you're talking about root beer, I plead guilt-didilly-ilty as char-dardilly-arged."
Ned Flanders,I'm meek... but I could probably stand to be meeker.
Ned Flanders,"...Well, I... I think I may be coveting my own wife..."
Ned Flanders,"Uh, I'm in some hot soup here, Marge. Uh, some teenagers are hanging out in front of the store. I... I think they could start slacking at any moment."
Ned Flanders,"Uh, excuse me, fellas... I... I couldn't help thinking it might be nice if you could uh, vamoose, you know. If possible."
Ned Flanders,"Uh, Marge, I... I appreciate your advice, but, uh, things have gotten... Well, they... they're a lot worse."
Ned Flanders,"Yeah, it's Ned Flanders. The teens have been chasing me all night. They finally stopped to gas up their scooters."
Ned Flanders,"Oh, I can't see the name of the station... but the gas costs one forty-nine and eight tenths."
Ned Flanders,Tell Maude I want a fancy funeral. Big coffin. Lotsa jewels.
Ned Flanders,"You saved me, Reverend. You really went above and beyond. Thank you!"
Ned Flanders,"Well, sir, I hate to be a Suspicious Aloysius on you, but did you steal my air conditioner?"
Ned Flanders,"Ex... ex... excuse me, sir? I think you've got my TV. Sir?"
Ned Flanders,"Ho-ho-ho, you betcha. Team sports'll keep you away from temptations like rock music and girls."
Ned Flanders,"Little higher, Wendell... A lot higher, Martin... Ah, Ralph, that's a basketball."
Ned Flanders,"Well, that's super-duper, Lisa! In fact, we already have four girls on the team."
Ned Flanders,"All right, Wildcats! Are you ready to give 110 per cent, take it one game at a time, and go the whole nine yards?"
Ned Flanders,Do you have a problem with the way I'm coaching?
Ned Flanders,"Uh-huh. Half a brain, huh? Well, you know what? It sounds like you just volunteered!"
Ned Flanders,"Oh-ho, I gotta say, Lisa, it sounds like you're strainin' to do some explainin'."
Ned Flanders,"Oh, we can work this out, friends. In the spirit of sharing, what say we simply place the sacred bones in--"
Ned Flanders,"Hey-hey there, Marge. Just brought the kids over to share a prayer with the blessed angel, if it's okay with you."
Ned Flanders,"Science is like a blabbermouth who ruins a movie by telling you how it ends. Well, I say there are some things we don't want to know! Important things!"
Ned Flanders,"We've come for the angel, Homer. It's not safe with the unbeliever."
Ned Flanders,"Reverend, I've got to admit, this doomsday warning has me just a smidge twitterpated."
Ned Flanders,"Well, shall we sing a hymn? Uh, ""Nearer My God to Thee"", maybe? Or, or, or ""Amazing Grace""?"
Ned Flanders,"Well, nothing's perfect, I sure hate to make you come out here and not buy a house."
Ned Flanders,"Hm. Wh-when you put it that way, it does seem a bit small."
Ned Flanders,"Oh, my-diddily-i. Will you look at this place! And the price has been slashed repeatedly!"
Ned Flanders,"Well, I'm just gonna spill my guts: I love it to death! I'm gonna give you a deposit this minute."
Ned Flanders,"Well, neighborinos, I guess this is goodbye... I better make this quick or I'm gonna start blubbering like a baby."
Ned Flanders,"Oh, you're sweet to offer, but, uh, we're all just so tired, we just want to get to our new house and rest in peace."
Ned Flanders,"Oh, hi, Marge. Heh-heh. Guess we gave you quite a start. We were painting Todd's room red -- pretty messy work -- and then we came out here to take a break. Must've dozed off."
Ned Flanders,"Ahh, of course! This must be where he dropped the dagger. And this is the butler's pantry where Mrs. Astor concealed herself. And right here's where they found the torso heap! In front of our very own fireplace!"
Ned Flanders,"We appreciate the offer, Marge, but I think we're going to be very happy here."
Ned Flanders,"Hey, heard some no-goodnik stole your tree. Well we got a 30 footer, so you can have the top of ours."
Ned Flanders,"Hey, I made some Rice Krispy squares for our hungry deprogramerinos!"
Ned Flanders,"Oh ho, I'm afraid I played a dirty part in this little charade."
Ned Flanders,"Uh, maybe we should take a little break-a-rooney, huh? Anyone like a draft beer?"
Ned Flanders,"You know, I pride myself on being a good host, so I'm obliged to offer you a beer. But I'm so darn mad it's gonna be mostly head."
Ned Flanders,Oops! That's for me. Flancrest Enterprises is my home business.
Ned Flanders,"No-ho-ho, it's true! Maude and I sell religious hook rugs over the Internet."
Ned Flanders,"It says ""Show me your tie."" It's cute. C'mon, let's go."
Ned Flanders,"Whoa! January first! Better get goin' on those taxes, Neddy!"
Ned Flanders,"Hmmm. Let's see, cash-register ink. Well, sir, that's a business expense, isn't it? Mmm... But then I do enjoy the smell of the stuff -- better not risk it."
Ned Flanders,"Ohhh, why, everything! Policemen, trees, sunshine. And let's not forget the folks who just don't feel like workin', God bless 'em."
Ned Flanders,8:45?! Here I am yappin' away like it's 8:35. Don't forget the mints.
Ned Flanders,"Uh, listen Homer, ah, hate to be a fussy Freddy and all, but Maude's folks are here and, ah, they're a tad touchy about odors..."
Ned Flanders,Heh. Sports on a Sunday? Hm. I'd better check with Reverend--
Ned Flanders,Hmm. That's odd. It didn't come out the rear end.
Ned Flanders,"Oh, now Roddy, it's just a stuck ball. I'll get it."
Ned Flanders,"Hey, here come the Simpsons. N-Now be careful, Homer. There's a fella in the sand right in front of ya..."
Ned Flanders,"Dear Lord, please make tonight's production better than ""Othello"" with Peter Marshall."
Ned Flanders,"I suppose, if you must know... I'm... well, I'm... I'm sixty."
Ned Flanders,"L-Listen, folks, there's no magic formula. I just follow the three C's: clean living, chewing thoroughly, and a daily dose of Vitamin Church."
Ned Flanders,"No, no, and double-no! I haven't done any of those things, folks. You name it, I haven't done it!"
Ned Flanders,"Oh, can you believe it? It almost seemed like those folks were, were, were making fun of old steady Neddy."
Ned Flanders,"Mmm-hmm. And some people steer clear of that whole hornet's nest. I'll stick with just plain white bread, thank you very much. Maybe with a--"
Ned Flanders,Gosh darn it! Am I that pre-diddley-dictable? I've wasted my whole dang diddley life.
Ned Flanders,In the bathroom. Not trimmin' my mustache. Whaddaya think? Do I remind you of troubled troubadour David Crosby?
Ned Flanders,"Here, this may sound just a teensy bit insane in the ol' membrane, Homer. But I, I was wondering if you could show me how to have some fun."
Ned Flanders,"How 'bout it, Homer? Will you teach me the secret of your intoxicating lust for life?"
Ned Flanders,"Of course I... Oh, my stars! I can't do that."
Ned Flanders,"Okay, Homer. I'm ready to learn. What's the first lesson? Just give me the topic sentence."
Ned Flanders,"Ooh, it's goin' on eight-thirty. I'd better call Maude and tell her where I am."
Ned Flanders,"Oh, the lights, the noise, the letter X -- i-it's all designed to inflame the senses. I'm overstimulated! I gotta get out of this town!"
Ned Flanders,"If he's not careful, his scooter could roll right down that ramp."
Ned Flanders,"Oh, when I wanna laugh, I'll take Bob Saget, thank you very much."
Ned Flanders,"No, Homer, no! I wanna do something exciting, but I can't just go from zero to thirty like that! I-I could be killed."
Ned Flanders,"God Homer, watching you risk your life turned my beat box all the way up to .. Rumba! Yea, I was praying you'd be safe but to be honest, part of me wanted to see ya get splattered."
Ned Flanders,"Aw, leave me out of this, Homer. Games of chance are strictly forbidden by Deuteronomy seven--"
Ned Flanders,"Oh, I got a bunch, Homer, but I just don't feel right ab... Oh, Lord, what should I do?"
Ned Flanders,"How do you do it, Homer? How do you silence that little voice that says, ""Think""?"
Ned Flanders,"I'll have a Shirley... no, a virgin... no, make it a children's... Oh, what the heck, you only live once. Give me a..."
Ned Flanders,"Look at this place! We must have really painted the town last night. I have a pounding headache, my mouth tastes like vomit, and I don't remember a thing!"
Ned Flanders,"Oh, I did it! I conquered my fears and I made up for a lot of lost livin'. And I owe it all to the Homer Simpson program."
Ned Flanders,"Homer! The bad news, ladies, is we already have wives."
Ned Flanders,"Homer, why don't we go make the girls some custom omelettes?"
Ned Flanders,"What are we gonna do, Homer? My kids are gonna be traumatized! And then there's Maude. And then there's Maude!"
Ned Flanders,"Well, do something! This is all your fault. You and your stupid program."
Ned Flanders,How are we going to get outta this mess in an honorable and decent--
Ned Flanders,"I don't want to be a Panicky Pete, but it's Sunday and I haven't been to church yet."
Ned Flanders,I can't believe it. We're actually in the winning locker room!
Ned Flanders,"Aw, gee, the man's just trying to show his wife he cares for her. How can we sabotage his labor of love?"
Ned Flanders,"You know, with all the energy we're puttin' into this sabotage thing, we coulda written sonnets for our wives, or learned to tango, or lovingly restored one of those antique..."
Ned Flanders,"Whew, well, at least I got a hunk of Moe's hair."
Ned Flanders,"Leapin' Lazarus! Is this what passes for eternal rest these days? Rod, go get Daddy his buryin' shovel."
Ned Flanders,Not so deep the Lord can't find him... and judge him.
Ned Flanders,"Excuse me, Reverend? It's, ah, hard to hear you with those fans goin'."
Ned Flanders,"Oh-ho-ho-ho, please. You're gonna give me a swelled head. I just stopped by to see if you needed anything."
Ned Flanders,"Well, I'd better skedaddle. Oh, there's one more weensy little thing -- you see that tree over there?"
Ned Flanders,"I hate to be a bossy Betty, but I have to forbid you to eat its fruit."
Ned Flanders,"Doggone it, Eve, I think you'd better hightail it outta this Garden!"
Ned Flanders,"And after I created my fingers to the bone for you I... My unicorn! Oh, what have they done to you, Gary?"
Ned Flanders,"Maude, it's a miracle! The Lord has drowned the wicked and spared the righteous!"
Ned Flanders,Looks like Heaven's easier to get into than Arizona State.
Ned Flanders,Everything but the opinion page! I don't need to be told what to think... by anyone living!
Ned Flanders,"Now, Homer, we can't have you burglarizing us every time you've got a bill to pay."
Ned Flanders,"Oh, we're not as well-off as you think. We give to eight different churches, just to hedge our bets. And the Leftorium's business has gone way downhill since Leftopolis moved in next door."
Ned Flanders,"Oh-ho-ho, we picked those up cheap. They were evidence in a murder trial!"
Ned Flanders,We got that tip at the Chuck Garabedian Mega-Savings Seminar.
Ned Flanders,He taught us how to live a Burt Reynolds lifestyle on a Mac Davis income. We've already got tickets for his next seminar.
Ned Flanders,I think you'll find living thrifty a lot more satisfying than stealing.
Ned Flanders,"Now for a regular cigarette, to make the night complete. Oh! Man, that's good."
Ned Flanders,"Ho-ho-ho! Why bother, baby? One smoke detector's enough for Mad Dog. Now let's hit the sack."
Ned Flanders,"Ha! Ha! Ha! That's for Clydes, baby. A little fire can't hurt you."
Ned Flanders,"Sorry to break character, but these stunt pants are getting pretty toasty!"
Ned Flanders,"Oh, I wish. You see, that night when you hit me with your car..."
Ned Flanders,I resisted these for thirty-five years! Why did I wear them today?
Ned Flanders,"Oooh, yes indeedy, Homer. Looks like they're settling in for a long stay."
Ned Flanders,"Well, if I were a member, we could use my rumpus room as our lair."
Ned Flanders,I move we reconsider our club name. Make it something a little less blasphemous. After all we don't want to go to Hell.
Ned Flanders,I've got a motorhome I never use. Maybe we should raffle it off.
Ned Flanders,"Feels like I'm wearin' nothin' at all. Nothin' at all, nothin' at all..."
Ned Flanders,"Oh, those poor souls. What's the Christian thing to do?"
Ned Flanders,"Uh, listen, Homer, we'd love to help you, but we're not really set up for lepers."
Ned Flanders,"No, no, no, no, no, no, no. I'm just thinking we could send you to a better place... you know, a place where they can really take care of you."
Ned Flanders,"Mm-hm. That's the one! They've got a top-notch leper colony there, so we shipped 'em right off. Ooh, cost us a bundle, too. I guess we'll have an ""Imagination Christmas"" this year."
Ned Flanders,"Ah, yeah, I, I couldn't help but notice you, you picked pretty much all of my flowers."
Ned Flanders,"Oh-ho, true enough. But, uh, did you have to salt the earth so nothing would ever grow again?"
Ned Flanders,"Well, I don't care for the speed, but I can't get enough of that safety gear. Helmets, roll-bars, caution flags..."
Ned Flanders,"Abso-not-ly, hot Roddy. We're up here, out of range of the crashes and the drivers' cussing."
Ned Flanders,"That's nice of you Homer, but I think I'll just go to bed."
Ned Flanders,"I just keep replaying the whole thing in my head. I can't believe my last words to Maude were ""No foot-longs."""
Ned Flanders,"If I'd only been a gentleman and got the hot dogs myself, she'd still be here."
Ned Flanders,"Ah, you're right. I've just got to work through the grief. There's not gonna be an easy answer."
Ned Flanders,"Oh, it's been a hard couple of months, but I feel like I've turned a corner."
Ned Flanders,"Homer, you obviously went to a lot of trouble, but dating? It just feels way too soon."
Ned Flanders,"Well, with triple word score, that's ninety! Ha-ha, I guess my luck is starting to even out."
Ned Flanders,"Homer, I'm having second thoughts. This feels so disloyal to Maude."
Ned Flanders,"Mmm. Dinner was delicious, Edna, but I can't shake the feeling that you're just using me to get Principal Skinner jealous."
Ned Flanders,"Well, Diane, I've sure enjoyed chatting with you about your problems with your mother."
Ned Flanders,"Well, I just can't relate to the women of today, Homer. Ah, it's probably me. I'm about as exciting as a baked potato."
Ned Flanders,"Lord, I never question you... but I've been wondering if your decision to take Maude was, well, wrong... Unless this is part of your divine plan... Could you just give me some kinda sign? Anything? And after all that church chocolate I bought. Which, by the way, was gritty and had that white stuff on it. Well, I've had it."
Ned Flanders,"Eh, you boys can go with the Simpsons. I'm not going to church today."
Ned Flanders,That's right. And I may not go to church tomorrow.
Ned Flanders,"No, I'm not kidding. I am gonna sit right here and miss church. You just watch."
Ned Flanders,"Electric guitars in church? Oh, my gosh. Some dropouts must have overpowered the Reverend!"
Ned Flanders,"I'll be right back, boys. I'm going to go help that lady."
Ned Flanders,"Uh, that was a lovely song. It really got to me."
Ned Flanders,"No, I hear what you're saying. It's always hard to replace someone."
Ned Flanders,"Well, that, that sounds real nice, Rachel, but a... I'm a... I'm not quite..."
Ned Flanders,"Maybe we can. My name's Ned Flanders, and I'm here every week. Rain or shine."
Ned Flanders,"Ah yeah, I never shoulda had that trendy laser surgery. It was great at first, but you know, at the ten-year mark, your eyes fall out."
Ned Flanders,Yeah. Just answer me this: Are you holding your mooching sack?
Ned Flanders,"Bart, you're never gonna to grow up if I keep bailing you out."
Ned Flanders,"Oh, all right. But only because you haven't outed Rod and Todd."
Ned Flanders,"Actually, Homer, you and I worship the same God, so..."
Ned Flanders,"Well, it was a little insensitive giving me a sex test, seeing that my wife just passed away."
Ned Flanders,Six months ago. You were at the funeral. You fell into the grave.
Ned Flanders,I'd see 'em sittin' on that couch all day long... just starin' at that Hollywood hogwash.
Ned Flanders,"Hey, uh, careful, boys. That arch is lookin' a little Romanesque."
Ned Flanders,"Homer, it's Neddy. I baked you a little something to ease the pain."
Ned Flanders,"""They're Controlling Our Minds With Flu Shots?!"" I knew it. Well kids, now aren't you glad we don't believe in inoculations?"
Ned Flanders,"Oh, no, Homer, remember? Maudie got called up to Heaven."
Ned Flanders,"Well, I'll just reimburse you right n-- Wait a minute. This seems an awful lot like that movie, ""Paper Moon."""
Ned Flanders,"Well, I'm all for rescuing the kids, but I wish you hadn't sawed off my roof."
Ned Flanders,"Hey, whatever happened to the plow from your old snowplow business?"
Ned Flanders,"Sure you did -- ""Mr. Plow."" You're wearin' the jacket right now!"
Ned Flanders,"Mmm-hmm. This one's fine and dandy, Roddy. It's approved by a council of Presbylutheran ministers."
Ned Flanders,"We'll just see about that-- Uh-oh. Well, maybe he made a mistake-- Nope. It's airtight."
Ned Flanders,"Well, in that case... My neighbor Homer released a radioactive ape in my house. It's ah, it's taken over the whole top floor."
Ned Flanders,"Look, if you want me to turn, just point. That w..."
Ned Flanders,...and Harry Potter and all his wizard friends went straight to hell for practicing witchcraft.
Ned Flanders,"Uh, uh, huh, oh, hey, Rachel. W-Well what do you know? We both like plain vanilla with nothing on it."
Ned Flanders,"Well, my wife's passing was rough, but I think I'm finally ready to move on."
Ned Flanders,"I'd love to get together, but tomorrow I've got lifeguard duty at the baptismal pool."
Ned Flanders,"Now wait just a Maude-gone minute, here. I'm through living in the past, and you can see for yourself."
Ned Flanders,"All right, I'll take the couch and you can have my room."
Ned Flanders,"Oh, ah, c-c-could you sleep on my side? I-I'm trying to preserve Maude's indentation."
Ned Flanders,"Ohh, no problem. A little starch will fix her right up."
Ned Flanders,"Mm. Well, goodnight, Maude. I mean, Maude. I mean, Rachel. I mean, Maude."
Ned Flanders,"No, n-n-no I know this is a-a-a tad unseemly, but if you'd just let me even out the back..."
Ned Flanders,"Oh, who am I kidding? I'm not over Maude at all."
Ned Flanders,"I sure appreciate you folks offering to go through Maude's things. If it were up to me, I wouldn't throw anything away."
Ned Flanders,"Yeah, just a little shocked. What's that? Some kinda sorting machine?"
Ned Flanders,"Maude's old sketch book. She was quite the little artist, you know."
Ned Flanders,Here's our house... a rainbow... a white hand shaking a black hand...
Ned Flanders,"Maude designed a Christian amusement park. Oh, it must have been her final dream."
Ned Flanders,"Ohhh, that's a nice thought, Toddy, but to build an amusement park you need lots of money, and manpower, and turnstiles..."
Ned Flanders,"Well, what the heck. Who's ready to build an amusement park?"
Ned Flanders,"Well, it's been closed for so long... and-and I thought I could turn it into a Christian theme park."
Ned Flanders,"Now the thing is, I don't have a lot of money..."
Ned Flanders,"If you could do that, I'd make this place a shining beacon for the Lord."
Ned Flanders,"Ah, Gipetto's workshop will make a great stable for the nativity scene."
Ned Flanders,"Well, it's been a tad harder than I thought, but I'm not complaining 'cause I work for a sweet, sweet, boss. You're our foreman, Maude."
Ned Flanders,"Oh, I don't mind, but my greenback stack's gettin' kinda slack."
Ned Flanders,"Ohhh, I'm not very good at begging people for stuff."
Ned Flanders,"Morning, Kent. Our volunteers have done an amazing job getting the park ready here. We're gonna show Springfield that faith and devotion are the wildest thrill rides of all."
Ned Flanders,"Ohh, what can I get you, little Christian? How 'bout a Noah's Ark of Jellies?"
Ned Flanders,"Ohhh, you want me to stamp your hand so you can get back in?"
Ned Flanders,"Oh, Maude, I turned your dream of a Christian amusement park into a bemusement park."
Ned Flanders,"I'm sorry, sweetheart. Oh, please don't look at me like that."
Ned Flanders,"Oh, there's no explaining God's will, Roddy. That's like explaining how an airplane flies."
Ned Flanders,"Oh, no! This isn't a devine miracle. Everyone's just gettin' goofy from the gas."
Ned Flanders,"Ah, ah, folks, I've just discovered something about this statue that uh, may disappoint you. You see..."
Ned Flanders,"Hello, Gas Company? How poisonous is your gas?... Wow. But-- Eh, but I'm talkin', you know, about outdoors with plenty of ventilation that... How could that be worse?... Okay, permanent brain damage, or just temporary?... I see."
Ned Flanders,"How 'bout I explain it to you over a cup of coffee. That is, if you're willing to give me another shot."
Ned Flanders,"Hey, Homer, I need to ask ya a favor. My baby sitter canceled and I got tickets to a Christian rock concert."
Ned Flanders,"It's gonna be one wholesome evening. So, do you think Marge could take care of rowdy Roddy and Typhoon Todd?"
Ned Flanders,Would you mind watching the kids? I'm kinda in a pickle here.
Ned Flanders,"Well, sir, I never heard a preacher use the ""m-f"" word so many times. Anyway, thanks again."
Ned Flanders,"Well, I sure would. It would give the boys a place to go after school."
Ned Flanders,You're using my table saw to violate a court order?
Ned Flanders,"Gee, I always like to help you, Homer, but I don't want to be an accessory to some sort of shady doin's. And it does raise a whole host of ethical questions, such as..."
Ned Flanders,"Greetings from Nedily Space Center on Cape Flandaveral. We noticed your sky-ro-technics and thought we'd join in. Ooh, looks like a perfect landing!"
Ned Flanders,"It's kind of you to offer, Mr. Burns, but buzz around town is that you're, well, evil."
Ned Flanders,"My Satan sense is tingling! Into the root cellar, boys!"
Ned Flanders,"Well, Ginger, sure is, uh, um, neat that you managed to hunt me down."
Ned Flanders,"Oh Lord, I know my new wife is a little more... ""peppermint"" than you're used to. But, uh, I know you'd want me to honor my sacred vows, so I will."
Ned Flanders,Me and the boys made you breakfast in bed. It's the best darn diddly way to start your first Flanders day!
Ned Flanders,"Whoops. Watch the swears, Honey Bear. We don't use the ""I"" word in this house."
Ned Flanders,I'll say. I'd really like to go out and get the mail.
